labels,topPlus,suggestedTexts,province,status,hasVideo,thumbnail,size,priceByArea,has3DTour,numPhotos,showAddress,municipality,country,hasLift,longitude,detailedType,highlight,district,hasPlan,newDevelopment,propertyType,rooms,topNewDevelopment,address,propertyCode,externalReference,price,floor,operation,url,exterior,description,parkingSpace,has360,latitude,hasStaging,bathrooms
nan,False,"{'subtitle': 'Alcobendas Centro, Alcobendas', 'title': 'Flat'}",Madrid,good,False,https://img3.idealista.com/blur/WEB_LISTING/0/id.pro.es.image.master/62/68/f9/1198408074.jpg,50.0,3840.0,False,24,False,Alcobendas,es,False,-3.6368726,{'typology': 'flat'},nan,Alcobendas Centro,False,False,flat,2,False,Alcobendas Centro,102248549,W-02S7CA,192000.0,nan,sale,https://www.idealista.com/inmueble/102248549/,True,"Bright and cozy apartment in Alcobendas Engel & Völkers presents this excellent house renovated just 3 years ago with 2 bedrooms, 1 bathroom, living room and kitchen with induction hob and practically new designer furniture. Located on the second floor of the building, this beautiful apartment has natural gas heating and air conditioning with a hot/cold pump. All the rooms in the house have a window with exterior views and are oriented to the east. Characteristics that make this house very bright and welcoming. In addition, it is located in a quiet street, close to shops, supermarkets, bars, health centers, and is a few meters from different bus stops and the Madrid Marqués de la Valdavia metro. Don't wait any longer and take advantage of the opportunity to live in this cozy apartment, recently renovated, and with all the comforts you may need. Alcobendas, a city to live in, is located north of the capital. Connected through the A1 by car, Line C4 of the Renfe commuter train, Line 10 of the Metro and several bus lines. Likewise, it is located just 10 minutes by car, 30 minutes by public transport, from Madrid Barajas Adolfo Suarez Airport. In the downtown area of the town of Alcobendas you can find all kinds of services: local shops, supermarkets, playgrounds, sports centers, schools, universities and health centers. and it is very close to the Infanta Sofía Hospital. In addition, the industrial and business area of Alcobendas allows you to reconcile work and family life in complete comfort. This house has all kinds of shops, schools, parks and sports areas less than 5 minutes away and is located a few meters from the main bus stops, and the Madrid Marqués de la Valdavia metro station and 1.2 km from the suburban train stop Alcobendas/S. S. de los Reyes.",nan,False,40.5367231,False,1
nan,False,"{'subtitle': 'Norte, Alcobendas', 'title': 'Flat in Avenida de Valdelaparra'}",Madrid,good,True,https://img3.idealista.com/blur/WEB_LISTING/0/id.pro.es.image.master/c4/ba/ae/1198164453.jpg,134.0,3619.0,False,58,False,Alcobendas,es,True,-3.6623075,{'typology': 'flat'},nan,Norte,True,False,flat,3,False,Avenida de Valdelaparra,103160517,05174,485000.0,1,sale,https://www.idealista.com/inmueble/103160517/,True,"Nice apartment of 134 m2, 113 m2 useful, completely renovated in 2016. After entering the house you find yourself in a large hall which leads, on one side, to the kitchen, facing the living room and terrace with views of the urbanization, swimming pools and common areas. The apartment has three bedrooms, 2 very large bedrooms with built-in wardrobes and a third that has been converted into a fabulous dressing room with 8 linear meters of wardrobes, included in the master bedroom suite. (It can be converted back into a third room without work) Large square kitchen, with clothesline with washing machine and boiler, and in the kitchen itself a stainless steel combi refrigerator, microwave, oven, induction hob, stainless steel hood, stainless steel dishwasher, and second paneled freezer. Silestone countertop. The main bathroom is very spacious and has a walk-in shower. The second bathroom is a small spa, with an impressive two-seater jacuzzi, WC, sink, and heated towel rail. Included in the price is a garage space.  It has hot/cold air splits in the living room and the 3 bedrooms. It also has double windows in all rooms, which serves as thermal and acoustic insulation, making heating much more efficient. There is no traffic noise in the house, it is super quiet, since it is all oriented towards common areas. All windows also have mosquito nets installed. The community has a concierge, who collects parcels with prior authorization, a swimming pool and paddle tennis courts. Community receipt for housing and parking space: 160 euros. IBI: 495 This apartment does not have a storage room Possibility of leaving it semi-furnished, to move into. AROUND: This apartment is located 750 meters from the Valdelasfuentes commuter station, and has bus stops in front of the portal. For lovers of nature, sports and hiking, the house is located in front of Monte de Valdelatas. Next to municipal parks, with soccer and basketball fields, playgrounds, dog parks and beautiful green areas. 500 meters away are commercial areas with restaurants, supermarkets, pharmacies, banks, schools, institutes, etc. It is a very quiet and safe area. We also have the municipal police on the same street 500 m away. SPORT: Valdelasfuentes Sports Center (Alcobendas) Dehesa Boyal Sports Center (San Sebastián de los Reyes) SCHOOLS AND UNIVERSITIES: You will be surrounded by the best campuses, institutes and colleges. Pontifical University of Comillas, Autonomous University. MEDICAL AND HEALTH CENTERS: Alcobendas Health Center and 5 minutes by car is the Infanta Sofía University Hospital.","{'hasParkingSpace': True, 'isParkingSpaceIncludedInPrice': True}",False,40.5425385,False,2
nan,False,"{'subtitle': 'Norte, Alcobendas', 'title': 'Flat in Paseo de Valdelasfuentes'}",Madrid,good,False,https://img3.idealista.com/blur/WEB_LISTING/0/id.pro.es.image.master/2d/4e/3c/1197321033.jpg,125.0,4480.0,False,28,False,Alcobendas,es,True,-3.6559366,{'typology': 'flat'},nan,Norte,False,False,flat,3,False,Paseo de Valdelasfuentes,103280995,W-02TZJC,560000.0,2,sale,https://www.idealista.com/inmueble/103280995/,True,"Excellent 3-bedroom apartment with large terrace in Alcobendas Excellent 3-bedroom apartment with a large terrace in Alcobendas. Engel & Völkers offers you this impeccable exterior apartment located in a private urbanization with beautiful gardens, swimming pool and children's play area. This home was delivered in 2001, we highlight the good distribution of the home and the feeling of tranquility it conveys. It has a large 15 m2 terrace where you can enjoy the outdoors from the privacy of your home. The house enjoys wonderful light and excellent views of the Valdelasfuentes promenade. It is distributed in an entrance hall that gives access to the house. Bright large independent living-dining room with access to the terrace, charming fully furnished kitchen with refrigerator, dishwasher, oven and clothesline with washing machine. The house has three bedrooms, the master bedroom with an en-suite bathroom. Built-in wardrobes in the entrance and in the three bedrooms. Two easily accessible parking spaces complete this offer. Alcobendas is one of the most sought-after areas in the North of Madrid due to its good geographical location in the midst of urban expansion. It is located in one of the most sought-after residential areas of Alcobendas, a few steps from the Valdelasfuentes Renfe station and the main bus stops. Close to a wide range of services: schools, institutes, parks, health center, supermarkets, shopping centers, restaurants, cafes, Valdedelasfuentes sports center, etc. It also has direct exits to Madrid M30 and M40 and also to A1 Burgos and Carretera de Colmenar Viejo. Expanding and profitable area since it is very close to the new area to be urbanized called ""Los Carriles"".","{'hasParkingSpace': True, 'isParkingSpaceIncludedInPrice': True}",False,40.5479557,False,2
nan,False,"{'subtitle': 'Norte, Alcobendas', 'title': 'Flat in Sonrisa'}",Madrid,good,False,https://img3.idealista.com/blur/WEB_LISTING/0/id.pro.es.image.master/27/65/0d/1199321797.jpg,111.0,4234.0,False,37,False,Alcobendas,es,True,-3.6585579,{'typology': 'flat'},nan,Norte,True,False,flat,2,False,Sonrisa,103759678,nan,470000.0,3,sale,https://www.idealista.com/inmueble/103759678/,True,"LE CLÉ (Real Estate Services) offers an exclusive pre-owned apartment in Fuentelucha. The house has 2 bedrooms with built-in wardrobes and 2 bathrooms (one included in the master bedroom en suite). The main bathroom is equipped with a large shower, double sink and vanity unit. Kitchen equipped with high and low furniture, compact quartz countertop and all appliances: Extractor hood, electric oven and column microwave, induction hob, washing machine, dishwasher and combi refrigerator. Large entrance hall with built-in wardrobe. Living room with access to terrace with views of the common areas. White lacquered interior carpentry with chrome handles. Anodized aluminum exterior carpentry and thermal bridge break. The glazing is double glass and the windows opening in the bedrooms are tilt-and-turn. Heating through underfloor heating throughout the home with thermostat in the living room and bedrooms. Air conditioning in living room and bedrooms, using individual heat pump. It has 2 parking spaces and a storage room. Gated community, swimming pool with night lighting and solarium area. The common areas have closed circuit television. Physical doorman. Fuentelucha is a new neighborhood in Alcobendas that has all the services, schools, daycares, shops, restaurants. It is located 10 minutes walk from Renfe Valdelasfuentes and has quick access to A-1. NO COMMISSION IS CHARGED TO THE BUYER.","{'hasParkingSpace': True, 'isParkingSpaceIncludedInPrice': True}",False,40.5547125,False,2
nan,False,"{'subtitle': 'Alcobendas Centro, Alcobendas', 'title': 'Flat'}",Madrid,good,True,https://img3.idealista.com/blur/WEB_LISTING/0/id.pro.es.image.master/4b/16/ac/1164349608.jpg,108.0,2389.0,False,27,False,Alcobendas,es,True,-3.6316005,{'typology': 'flat'},nan,Alcobendas Centro,True,False,flat,3,False,Alcobendas Centro,102111942,04761,258000.0,3,sale,https://www.idealista.com/inmueble/102111942/,True,"NO FEES TO THE BUYER If you are looking for a centrally located apartment, very well located, bright and with a great distribution…. this is your apartment THIS HOUSE IS SPECIAL BECAUSE Which is located in a magnificent area of Alcobendas surrounded by all services and transport at your fingertips. DISTRIBUTION The home is located on the third exterior floor of the building. It has a hall that leads to a large and bright living room with access to a terrace overlooking a quiet street. A large kitchen, another hallway through which you access two large bedrooms with built-in wardrobes and a full bathroom that serves these rooms and a third en suite with a dressing room. COMMUNICATIONS The home is located in the urban area of Alcobendas, a city to live in located north of the capital. Connected through the A1 by car, Renfe suburban Line C4, Metro Line 10 and several bus lines. Likewise, it is located just 10 minutes by car, 30 minutes by public transport, from the Madrid Barajas Adolfo Suarez airport. COMMERCIAL AND LEISURE AREA In this town there are important shopping centers such as La Vega (Alcampo among others), Carrefour, Río-Norte (Decathlon, Toys'r'us, Décimas,... ), Diversia Leisure Center, Moraleja Green (CC Sánchez Romero among others). It also has two business parks: La Moraleja and Arroyo de la Vega, where important companies have established their headquarters, especially related to new technologies. SCHOOLS AND HOSPITALS In the central area of the town of Alcobendas you can find all kinds of daycare centers, schools, public, subsidized and private universities, as well as health centers, being very close to the Infanta Sofía Hospital. Basic characteristics of the property: •108 m² built, •3 rooms •2 bathrooms •Terrace •Built-in wardrobes •Second hand/good condition •Individual heating: Natural gas •Reinforced door •park * 10 m2 storage room NOT included in the price €15,000 Edifice •3rd floor exterior * Parking in the same building •With elevator Energy certificate •Consumption: E 275 •Emissions: E 58 See energy rating label.",nan,False,40.5432364,True,2
nan,False,"{'subtitle': 'Ensanche, Alcobendas', 'title': 'Flat in Plaza del Maestro Tárrega'}",Madrid,good,False,https://img3.idealista.com/blur/WEB_LISTING/0/id.pro.es.image.master/40/f6/6c/1027953770.jpg,99.0,2414.0,False,40,False,Alcobendas,es,True,-3.6470645,{'typology': 'flat'},nan,Ensanche,False,False,flat,3,False,Plaza del Maestro Tárrega,98605520,10060726871,239000.0,1,sale,https://www.idealista.com/inmueble/98605520/,True,"REIN Group offers you a 93 m2 apartment in the center of Alcobendas, in the area located between the Town Hall and the Valdelasfuentes Sports City. The house is distributed in 3 bedrooms, bathroom, living room and kitchen, in a building with an elevator. It also has 2 terraces, one of them glazed. This home is sold together with a storage room. It is located in an area with all services at street level; shops, restaurants, supermarkets, pharmacy, sports centers, parks, children's areas, schools.. . If you need more information, do not hesitate and contact us at or at.",nan,False,40.5501881,False,1
nan,False,"{'subtitle': 'Valdelacasa, Alcobendas', 'title': 'Flat'}",Madrid,good,False,https://img3.idealista.com/blur/WEB_LISTING/0/id.pro.es.image.master/40/4d/9c/1130694835.jpg,95.0,2358.0,False,20,False,Alcobendas,es,True,-3.6512587,{'typology': 'flat'},nan,Valdelacasa,True,False,flat,1,False,Valdelacasa,101694784,002327,224000.0,bj,sale,https://www.idealista.com/inmueble/101694784/,True,"Total surface area 95 m², loft usable floor area 85 m², double bedrooms: 1, 1 bathrooms, air conditioning (hot and cold), age ebetween 10 and 20 years, lift, heating (electric), ext. woodwork (pvc), kitchen (abierta), dining room (abierto), state of repair: in good condition, car park, furnished, floor no. : 1, facing south, automatic door phone, security system (conserje), sunny, lands: floating platform, exterior.","{'hasParkingSpace': True, 'isParkingSpaceIncludedInPrice': True}",True,40.5293186,False,1
nan,False,"{'subtitle': 'Alcobendas Centro, Alcobendas', 'title': 'Flat in Calle Constitucion'}",Madrid,good,True,https://img3.idealista.com/blur/WEB_LISTING/0/id.pro.es.image.master/59/db/fb/1198886200.jpg,85.0,2424.0,False,27,False,Alcobendas,es,True,-3.6355408,{'typology': 'flat'},nan,Alcobendas Centro,False,False,flat,3,False,Calle CONSTITUCION,103746014,24-001,206000.0,2,sale,https://www.idealista.com/inmueble/103746014/,True,"PRIMER LEVEL INMOBILIARIA sells this magnificent apartment that is totally exterior and has all large rooms. It is very well located, a few meters from the ""Marqués de la Valdavia"" metro station, regular bus lines and 450 meters from the Renfe Station. It is a central apartment, with a good location with respect to local shops, restaurants, libraries and other services. The urbanization has a private area with a children's play area, gardens and elevator. The house is very bright and has a very pleasant distribution, with the following configuration: As we enter, we are welcomed by a large hall, on the right hand side, it is made up of 3 bedrooms and a bathroom, and to the other side, it has a large Separate living room and a wonderful kitchen with large windows to the outside and very usable, since it has no corners with lost meters. The heating is independent, with natural gas and a Saunier Duval brand digital boiler has recently been installed. With 20 years of experience in the real estate sector, our team is at your disposal to help you with everything you need. Don't miss the opportunity to live in this wonderful property! Contact us today to learn more about the mortgage financing terms available.",nan,False,40.5433735,False,1
nan,False,"{'subtitle': 'Ensanche, Alcobendas', 'title': 'Flat in Plaza del Maestro Tárrega'}",Madrid,good,False,https://img3.idealista.com/blur/WEB_LISTING/0/id.pro.es.image.master/a2/96/0b/1193546831.jpg,93.0,2570.0,False,12,False,Alcobendas,es,True,-3.6457148,{'typology': 'flat'},nan,Ensanche,False,False,flat,3,False,Plaza del Maestro Tárrega,103566691,8378AS-SG,239000.0,1,sale,https://www.idealista.com/inmueble/103566691/,True,"This flat is at Plaza del Maestro Tárrega, 28100, Alcobendas, Madrid, on floor 1. It is a flat that has 93 m2 and has 3 rooms and 1 bathrooms. It has terrace, ascensor, aire acondicionado, exterior, individual heating, storage room included and luminous.",nan,False,40.549025,False,1
