labels,topPlus,suggestedTexts,province,status,hasVideo,thumbnail,size,priceByArea,has3DTour,numPhotos,showAddress,municipality,country,hasLift,longitude,detailedType,district,hasPlan,newDevelopment,propertyType,rooms,topNewDevelopment,address,propertyCode,externalReference,price,floor,operation,url,exterior,description,parkingSpace,has360,latitude,hasStaging,bathrooms
nan,False,"{'subtitle': 'El Pastel, Boadilla del Monte', 'title': 'Semi-detached house in Cabo De Finisterre'}",Madrid,good,True,https://img3.idealista.com/blur/WEB_LISTING/0/id.pro.es.image.master/fe/7c/d9/1171292911.jpg,315.0,2730.0,True,44,False,Boadilla del Monte,es,nan,-3.915525,"{'typology': 'chalet', 'subTypology': 'semidetachedHouse'}",El Pastel,True,False,chalet,4,False,CABO DE FINISTERRE,102870818,RO190836,860000.0,nan,sale,https://www.idealista.com/inmueble/102870818/,nan,"At Gilmar you buy without fees! Gilmar exclusively presents this magnificent 315m2 semi-detached house on a 295m2 plot in a gated community with a swimming pool in the El Pastel Area. A cozy house, with large spaces, lots of light and a fantastic garden with a private salinized pool. The house welcomes us with a large living room from which we access, through a large window, a beautiful porch with various environments and the private garden of the house which we can enjoy all day, thanks to its unbeatable orientation and its private pool. Both environments integrate perfectly thanks to the light and its feeling of space. The kitchen, independent, bright and also with access to the garden, an office/bedroom and a guest toilet. Large hall closet. On the first floor, we find 3 spacious en-suite bedrooms, the main one joining two with a terrace, an outdoor bathroom with a shower and two dressing rooms. Good dressed and lined wardrobes. In the basement, laundry room, guest toilet and recreation area converted into a bar with different environments and an ethane fireplace. Fun stay to enjoy with friends. The house has a closed garage for two cars that is accessed from inside the urbanization. White lacquered interior carpentry, Climalit exterior, wooden floors and porcelain stoneware, heating by radiators with natural gas and pre-installation of air conditioning. Located next to the Olivar del Mirabal urbanization, one of the best areas of Boadilla del Monte; next commercial area and all services, etc. Easy access to exit M50, M40, A5, A6 and M-501 and public transport. Excellent private schools in the area such as Mirabal International School and St. Michaels School, as well as public and concerted ones. Very well located in one of the best residential areas of Boadilla del Monte. Do not hesitate to visit it! At Gilmar Real Estate Consulting we accompany you on this path, offering you all our experience. If you need to sell your home, we put at your disposal our more than 35 commercial teams and our important portfolio of clients actively searching for a home, in addition to our investment and financial department from which we can offer our clients the best conditions. mortgage market. For us, the most important thing is you and we will defend your interests as if they were our own. Do not hesitate to contact us!","{'hasParkingSpace': True, 'isParkingSpaceIncludedInPrice': True}",False,40.4215959,False,5
"[{'name': 'villaType', 'text': 'Villa'}]",False,"{'subtitle': 'Valdecabañas, Boadilla del Monte', 'title': 'Detached house'}",Madrid,good,True,https://img3.idealista.com/blur/WEB_LISTING/0/id.pro.es.image.master/64/26/fa/1184367249.jpg,471.0,3715.0,True,62,False,Boadilla del Monte,es,nan,-3.8819519,"{'typology': 'chalet', 'subTypology': 'independantHouse'}",Valdecabañas,True,False,chalet,5,False,Valdecabañas,102703404,W-02TDJ0,1750000.0,nan,sale,https://www.idealista.com/inmueble/102703404/,nan,"Spectacular designer villa in Boadilla del Monte Engel & Völkers presents this magnificent detached house of recent construction and winner of the 2017 Asprima architecture award. The house has 471 sqm built and a comfortable distribution on three floors. On the main floor, the entrance hall opens the way to the spacious and bright living room connected to the designer kitchen, from which you access, on the same level, to the charming porch that has a glazed area and a great chill out area, next to the pool. On this floor, there is also a guest toilet and a large suite with total independence from the rest of the house, with full bathroom and direct access to the garden. The staircase with glass railing and open steps leads to the second floor where we find three bedrooms; the master bedroom with a large dressing room and en suite bathroom and two more that share a bathroom. It is worth mentioning the luminosity of all the rooms provided by its large floor-to-ceiling windows and the exquisite care in each and every detail as well as the excellent construction. All bedrooms are connected by a large terrace from which you can enjoy the tranquility and green spaces of the surroundings. In the basement are the laundry room, the maid's room, a large storage room, a large room, perfect to be used as a family room, bathroom and an excellently equipped gym that enjoys natural light. It is equipped with the latest technologies and one of the best energy efficient aerothermal systems, which results in low maintenance and operating costs. The covered garage has capacity for two cars and also has a large storage area. Valdecabañas has become an exclusive residential area; the urbanization has 24-hour security and management. It belongs to the municipality of Boadilla del Monte, known for its large and well-kept green spaces, endowed with a wide range of educational, sports and commercial facilities, as well as hospital services, such as the Montepríncipe Hospital or the Puerta de Hierro Hospital, located 3 minutes away in Majadahonda, a town with which it borders to the north. With fast and convenient access to the main roads such as M-40, M-50, M-50 1 and M-503, it also has bus and light rail lines. The house is only 12 min. from the American School of Madrid, 9 min. from international schools and 3 min. from Trinity College. The municipality of Boadilla del Monte is a district of the Metropolitan Area of Madrid, located to the west of the capital, from which it is 15 km away. It has a population of 55,000 inhabitants and 47.2 km², bordering the municipalities of Majadahonda, Pozuelo de Alarcón, Alcorcón, Villaviciosa de Odón and Villanueva de la Cañada. It belongs in all its extension to the Guadarrama river basin. It is in a location that offers the best of this quiet enclave, just 25 minutes by car from the center of Madrid. On the one hand, you will be able to enjoy a fantastic outdoor lifestyle, as the area is surrounded by large forests that offer great air quality and a pleasant microclimate. On the other hand, you will be close to excellent services, including the best international schools, stores, sports clubs and hospitals.","{'hasParkingSpace': True, 'isParkingSpaceIncludedInPrice': True}",True,40.44048,False,5
"[{'name': 'villaType', 'text': 'Villa'}]",False,"{'subtitle': 'Valdecabañas, Boadilla del Monte', 'title': 'Detached house in playa de astilleros'}",Madrid,good,True,https://img3.idealista.com/blur/WEB_LISTING/0/id.pro.es.image.master/62/0a/6f/1182413443.jpg,290.0,2586.0,True,27,False,Boadilla del Monte,es,nan,-3.8897013,"{'typology': 'chalet', 'subTypology': 'independantHouse'}",Valdecabañas,True,False,chalet,4,False,playa de astilleros,103223100,nan,749900.0,nan,sale,https://www.idealista.com/inmueble/103223100/,nan,"Real estate agency in Boadilla del Monte INMOBILIARIA HOGARES BOADILLA DEL MONTE sells SPECTACULAR INDEPENDENT VILLA in the Exclusive VALDECABAÑAS Urbanization located in the municipality of Boadilla del Monte. This 290m2 independent home is built on a large 800m2 plot. The home is located in one of the most exclusive urbanizations in Boadilla del Monte and is distributed as follows: On the main floor, we find a large hall from where we access a large living room on two levels with direct access to the garden. A garden where we have infinite possibilities and that has a cozy gazebo and a large private pool. Continuing with the main floor, the next thing we find is a large renovated kitchen with an island and a dining room that serves the kitchen with direct access to the back of the garden and a guest toilet for the entire floor. The second floor is distributed in a large hallway that serves four large bedrooms and two full bathrooms, one of them en suite next to the master bedroom. In the outdoor area we also have a small building with two rooms that could be used as extra bedrooms or given the use that best suits your needs. It also includes an aerial garage with capacity for two vehicles. DON'T MISS THE OPPORTUNITY TO COME VISIT IT!","{'hasParkingSpace': True, 'isParkingSpaceIncludedInPrice': True}",False,40.4350667,False,3
"[{'name': 'villaType', 'text': 'Villa'}]",False,"{'subtitle': 'Valdecabañas, Boadilla del Monte', 'title': 'Detached house in Playa de la lanzada'}",Madrid,good,True,https://img3.idealista.com/blur/WEB_LISTING/0/id.pro.es.image.master/29/16/17/1190931020.jpg,580.0,2293.0,True,49,False,Boadilla del Monte,es,nan,-3.8893388,"{'typology': 'chalet', 'subTypology': 'independantHouse'}",Valdecabañas,True,False,chalet,8,False,Playa de la lanzada,103483775,nan,1329900.0,nan,sale,https://www.idealista.com/inmueble/103483775/,nan,"""CAPITAL HOME BRUNETE SELLS SPECTACULAR INDEPENDENT VILLA WITH POOL AND TENNIS COURT IN EXCLUSIVE URBANIZATION"" Welcome to the Valdecabañas urbanization in Boadilla del Monte! We present this impressive independent Villa, with a total constructed area of 580m² sitting on a plot of 2374m². With a versatile layout, this property has 9 large bedrooms, 5 full bathrooms and two toilets. On the ground floor, we find a large entrance hall, a large living-dining room, a very spacious kitchen with an office and a peninsula, 4 very bright bedrooms with built-in wardrobes and tilt-and-turn windows, 3 of them with an en-suite bathroom. On the first floor, we find 4 spacious rooms also with tilt-and-turn windows and built-in wardrobes. One of the rooms is much larger and has its own kitchen, making it possible to use it as an independent apartment. The semi-basement has a very large room equipped as a nightclub, a bedroom and a bathroom, we also find a garage with capacity for several vehicles. The exterior of the property is equally impressive, with a large swimming pool, a spectacular private tennis court, several chillout areas and porches. WE HAVE OUR OWN FINANCING DEPARTMENT. ""FOR ANY ADDITIONAL INFORMATION, DO NOT HESITATE TO CALL US AND WE CAN ARRANGE A VISIT. "".","{'hasParkingSpace': True, 'isParkingSpaceIncludedInPrice': True}",False,40.4424705,False,7
nan,False,"{'subtitle': 'Valdepastores - Las Encinas, Boadilla del Monte', 'title': 'Semi-detached house'}",Madrid,good,True,https://img3.idealista.com/blur/WEB_LISTING/0/id.pro.es.image.master/0d/13/5d/1166569828.jpg,468.0,2340.0,True,62,False,Boadilla del Monte,es,nan,-3.879674,"{'typology': 'chalet', 'subTypology': 'semidetachedHouse'}",Valdepastores - Las Encinas,True,False,chalet,5,False,Valdepastores - Las Encinas,102765703,VMO2306010,1095000.0,nan,sale,https://www.idealista.com/inmueble/102765703/,nan,"Chalet for sale in Valdepastores VILLA IN GATED COMMUNITY IN VALDEPASTORES  aProperties presents bright villa in gated community with communal pool and paddle tennis court in Valdepastores. The property offers ample interior spaces, generous windows and glass doors, underfloor heating, air conditioning and a fabulous garden. Its excellent location gives it privacy and convenient access to the M513, M503 and M50.   This villa of 468m2 according to the land registry is distributed over 3 floors:   First floor: This floor has a bedroom or office, a full bathroom, laundry area, a large multipurpose room, a cellar or storage room and a garage with capacity for 4 cars.   Second floor: Large living room with high ceilings, fireplace facing the garden. Bright kitchen with office and private access from the street for easy unloading of the purchase. We also find 3 bedrooms, one of them en suite with access to the garden. A bathroom that serves the other two bedrooms. From this floor there is access to the beautiful and spacious garden and a cozy terrace / gazebo with barbecue area.    Upstairs: Cozy living room open to the living-dining room on the second floor. On this floor is the master bedroom, with dressing room, en suite bathroom and a terrace with views. It also has a small storage space and offers the possibility of making an extra room, if desired.    Can you imagine living here?","{'hasParkingSpace': True, 'isParkingSpaceIncludedInPrice': True}",False,40.4153309,False,4
nan,False,"{'subtitle': 'Valdepastores - Las Encinas, Boadilla del Monte', 'title': 'Terraced house in Valdepastores'}",Madrid,good,True,https://img3.idealista.com/blur/WEB_LISTING/0/id.pro.es.image.master/05/5b/80/1197506032.jpg,295.0,2285.0,True,40,False,Boadilla del Monte,es,nan,-3.8883582,"{'typology': 'chalet', 'subTypology': 'terracedHouse'}",Valdepastores - Las Encinas,True,False,chalet,5,False,VALDEPASTORES,103592024,nan,674000.0,nan,sale,https://www.idealista.com/inmueble/103592024/,nan,"Real estate agency in Boadilla del Monte INMOBILIARIA HOGARES BOADILLA DEL MONTE sells SPECTACULAR SEMI-DETACHED VILLA in the Exclusive VALDEPASTORES Urbanization located in the municipality of Boadilla del Monte. This 238m2 semi-detached house is built on a 320m2 plot. The home is located in one of the most exclusive urbanizations in Boadilla del Monte and is distributed as follows: On the main floor, we find a large hall from where we access a large living room with fireplace and direct access to the garden. A garden where we have infinite possibilities and that has two cozy gazebos. Continuing with the main floor, the next thing we find is a large kitchen with a pantry and clothesline, a bedroom on the ground floor and a guest toilet for the entire floor. The second floor is distributed in a large hallway that serves three large bedrooms, all with a private terrace and two full bathrooms, one of them en suite next to the master bedroom. The ground floor is distributed in a bedroom with large storage spaces, an office and a full bathroom. We also have access to the garage that has space for two vehicles. In the outdoor area we have two large gazebos, a garden with unbeatable views and from where we can access the common areas of the urbanization, where we find the swimming pool and the tennis court. DON'T MISS THE OPPORTUNITY TO COME VISIT IT!","{'hasParkingSpace': True, 'isParkingSpaceIncludedInPrice': True}",False,40.4274258,False,4
"[{'name': 'villaType', 'text': 'Villa'}]",False,"{'subtitle': 'Las Lomas, Boadilla del Monte', 'title': 'Detached house'}",Madrid,good,True,https://img3.idealista.com/blur/WEB_LISTING/0/id.pro.es.image.master/04/6e/b7/1191022411.jpg,500.0,2848.0,True,47,False,Boadilla del Monte,es,nan,-3.8951287,"{'typology': 'chalet', 'subTypology': 'independantHouse'}",Las Lomas,True,False,chalet,5,False,Las Lomas,103457450,JI189689,1424000.0,nan,sale,https://www.idealista.com/inmueble/103457450/,nan,"Gilmar Boadilla sells detached villa in the urbanization of Las Lomas. Project by the architectural studio of Francisco Jurado. Located in a very quiet area of the urbanization, very close to the old Manolo Santana Club, which will soon be the David Lloyd Club. Built on a large plot of almost 2.700 square metres, perfectly consolidated and wooded. Great privacy and a large swimming pool. Outside, it has a large covered area for car parking. The house, with a built area of almost 500 square metres, is distributed on two floors. On the ground floor, entrance hall, office and bathroom. A large living-dining room with fireplace from which there is access to a covered porch, the swimming pool and the garden. On the same floor, kitchen with central island and a laundry and ironing room. On the upper floor, there is a master bedroom with dressing room and en-suite bathroom. From the hallway opening onto the ground floor, there is access to another two bedrooms with balcony, a complete bathroom and another room as an office or living room. The configuration of the plot allows for another floor under the house, with direct access from the garden, of approximately 90 square metres, which is currently used as a painting studio.  Also under the exterior porch, there is a very usable area in semi rough. The property has underfloor heating by ESAK, by natural gas, exterior carpentry of semi armoured aluminium with thermal bridge break, marble floors, oak wood flooring, etc. We can help you to find the financing that best suits your needs.","{'hasParkingSpace': True, 'isParkingSpaceIncludedInPrice': True}",False,40.4345883,False,3
"[{'name': 'villaType', 'text': 'Villa'}]",False,"{'subtitle': 'Las Lomas, Boadilla del Monte', 'title': 'Detached house'}",Madrid,good,True,https://img3.idealista.com/blur/WEB_LISTING/0/id.pro.es.image.master/5c/c6/19/1132944158.jpg,1219.0,1354.0,True,39,False,Boadilla del Monte,es,nan,-3.911727,"{'typology': 'chalet', 'subTypology': 'independantHouse'}",Las Lomas,True,False,chalet,6,False,Las Lomas,100814122,JI181213,1650000.0,nan,sale,https://www.idealista.com/inmueble/100814122/,nan,"Gilmar sells magnificent detached villa in the urbanization of Las Lomas in Boadilla del Monte. A large construction of 1,000 square metres on a plot of 2,144 metres.  The property is distributed over three floors. On the ground floor, a large entrance hall that leads to a distribution area with a lot of height, which leads to the rest of the rooms on the floor and with access to the stairs leading to the upper floor.  On the same floor there is a large living room with fireplace from which there is access to a large covered porch that gives access to the garden. There is also a very spacious kitchen, also with fireplace, a guest toilet, and several rooms that can be used as an office, living room, etc. There is also a bedroom with en suite bathroom on the same floor. Finally, next to the covered porch, there is a spectacular covered swimming pool with access to the garden and a changing room area.  Upstairs is the rest area. From the hallway there is access to a large master bedroom with terrace, large dressing room and en-suite bathroom with hydro-massage bathtub. In addition, there is another large bedroom with dressing room and en-suite bathroom. And finally, two more bedrooms each with its own bathroom. There is a second terrace with access from both bedrooms.  On the ground floor, there is a large leisure area for a cinema room or gym, two different rooms with bar, ironing and laundry area, complete bathroom, storage room and garage for four or five cars.  The property has very good construction qualities. Interior carpentry of lacquered wood, exterior carpentry of aluminium, underfloor heating with natural gas boiler, installation of air conditioning.  In the garden, it has a gazebo with tropical type pergola, and a paddle tennis court.  The urbanization has 24 hours security surveillance with security car circulation.","{'hasParkingSpace': True, 'isParkingSpaceIncludedInPrice': True}",False,40.4392584,False,7
"[{'name': 'villaType', 'text': 'Villa'}]",False,"{'subtitle': 'Las Lomas, Boadilla del Monte', 'title': 'Detached house'}",Madrid,good,True,https://img3.idealista.com/blur/WEB_LISTING/0/id.pro.es.image.master/48/78/d0/1138153342.jpg,600.0,2883.0,True,36,False,Boadilla del Monte,es,nan,-3.9030659,"{'typology': 'chalet', 'subTypology': 'independantHouse'}",Las Lomas,True,False,chalet,6,False,Las Lomas,101877488,JI187408,1730000.0,nan,sale,https://www.idealista.com/inmueble/101877488/,nan,"Gilmar sells an independent villa in the Las Lomas Urbanization, in Boadilla del Monte. With a constructed area of 600 square meters on a beautiful plot of almost 3,000 square meters, with great privacy, very consolidated and with a large pool. The house is distributed over three floors. On the ground floor, it has a large entrance hall from which you access the immense living room of the house. From the living room you can access the covered porch of the house. In addition, it has a separate dining room that communicates with a large kitchen with an island. Next to the kitchen, we find a service area, with a bedroom and bathroom. On the same floor there is a large office and a large guest bedroom with an en-suite bathroom. On the first floor, from the hall you access the master bedroom, very spacious, with an en-suite bathroom, with jacuzzi and shower, and access to a large terrace. Another bedroom with an en-suite bathroom, and finally, two other bedrooms that share a large bathroom. In addition, from the distributor there is access to a type of dressing room that serves the secondary bedrooms. In the basement, it has a large summer living room, a laundry room, a gym or auxiliary room, changing rooms for the pool and a bathroom that serves the pool. In addition, a large garage for four cars. The house has interior carpentry in carved oak wood, aluminum exterior carpentry, heating through a propane gas tank and air conditioning through Splits distributed throughout various areas of the house. The Las Lomas Urbanization has 24-hour security, schools, public transportation, etc.","{'hasParkingSpace': True, 'isParkingSpaceIncludedInPrice': True}",False,40.4279042,False,6
nan,False,"{'subtitle': 'Sector S, Boadilla del Monte', 'title': 'Flat in Ronda'}",Madrid,good,True,https://img3.idealista.com/blur/WEB_LISTING/0/id.pro.es.image.master/74/64/06/1180666441.jpg,130.0,4038.0,True,28,False,Boadilla del Monte,es,True,-3.8876924,{'typology': 'flat'},Sector S,True,False,flat,3,False,RONDA,103173547,nan,524900.0,2,sale,https://www.idealista.com/inmueble/103173547/,True,"Real estate agency in Boadilla del Monte INMOBILIARIA HOGARES BOADILLA DEL MONTE sells LARGE APARTMENT WITH GARAGE SPACE in the SECTOR S area of Boadilla del Monte. This home is located in an unbeatable environment, close to all types of shops, schools, means of transport and green areas. The house is distributed in a large hall that leads to a large living room with direct access to a large and cozy terrace. Kitchen with office, two large secondary bedrooms and a large master bedroom with dressing room and en-suite bathroom. It also has a second full bathroom that serves both the two secondary bedrooms and the rest of the house. The house has been renovated, thus giving it a more modern appearance due to the change of windows, interior carpentry and smoothing of walls. It has a garage and storage room. Private urbanization with pool. DON'T MISS THE OPPORTUNITY TO COME VISIT IT!","{'hasParkingSpace': True, 'isParkingSpaceIncludedInPrice': True}",False,40.4115016,False,2
"[{'name': 'villaType', 'text': 'Villa'}]",False,"{'subtitle': 'Las Lomas, Boadilla del Monte', 'title': 'Detached house'}",Madrid,good,True,https://img3.idealista.com/blur/WEB_LISTING/0/id.pro.es.image.master/eb/84/0a/1161624656.jpg,600.0,2917.0,True,46,False,Boadilla del Monte,es,nan,-3.9117202,"{'typology': 'chalet', 'subTypology': 'independantHouse'}",Las Lomas,True,False,chalet,5,False,Las Lomas,102615672,JI189773,1750000.0,nan,sale,https://www.idealista.com/inmueble/102615672/,nan,"Gilmar sells detached villa in the urbanization of Las Lomas de Boadilla del Monte. The property has a built area of 670 square meters, on a beautiful plot of almost 3,000 square meters. The plot is perfectly consolidated and is very flat, which allows you to enjoy a magnificent meadow and a large swimming pool. In addition, the garden has an outdoor pergola with barbecue area.  The property is distributed as follows:  On the ground floor, there is a large entrance hall, a large living-dining room with access to the garden, kitchen with island and also with access to the garden. On the same floor, there is a guest bedroom and a complete bathroom.  Going up a small flight of stairs, we find a hall that leads to the sleeping area. There is a master bedroom with dressing room and en-suite bathroom. There are also two further bedrooms that share another bathroom.  On another flight of stairs, it has an office area or semi attic bedroom and another bathroom. It also has a semi raw area.  Finally, in the basement, there is a bathroom, a living room, a large leisure area with a cinema room and bar, a small wine cellar and a gymnasium. The area has a laundry room and a garage for two or three cars.  The property has first quality materials, marble and wooden floors. Heating by gasoil tank with natural gas for the kitchen, and central air conditioning by ducts.","{'hasParkingSpace': True, 'isParkingSpaceIncludedInPrice': True}",False,40.4393039,False,5
