bathrooms,province,size,hasPlan,topNewDevelopment,suggestedTexts,hasVideo,rooms,has360,exterior,hasStaging,numPhotos,externalReference,country,hasLift,price,propertyCode,latitude,showAddress,parkingSpace,operation,labels,description,newDevelopment,detailedType,status,priceByArea,url,thumbnail,address,has3DTour,longitude,municipality,floor,propertyType,topPlus,highlight
4,Madrid,654.0,False,False,{'title': 'House in Calle Isaac Albéniz'},False,5,False,nan,False,47,bc14u7a3,es,nan,674000.0,103623984,40.6024139,False,"{'hasParkingSpace': True, 'isParkingSpaceIncludedInPrice': True}",sale,nan,"RIVE PRESENTS THIS SPECTACULAR VILLA IN PARQUE DE LAS COLINAS, A FEW KM FROM MADRID. OPEN DAY, NEXT SATURDAY, JANUARY 27 (PREQUEST CORRESPONDING FILTER OF EACH POTENTIAL BUYER). WHY THIS WILL BE YOUR NEXT HOME? As soon as we enter it gives us the feeling of being in a villa due to its large dimensions, and its palatial decoration, it has 654m2 of living space, on a plot with a total of 1,023m2. The first floor consists of a large hall, a renovated kitchen, a full bathroom, a built-in dining room, and a large living room with several rooms, as well as an integrated porch with direct access to the garden. As we go up to the hall, we find a hallway that gives access to two bedrooms, one of them the main one, which has an en-suite bathroom. The upper floor has another hall, with 2 built-in wardrobes, 3 bedrooms, and a bathroom. Likewise, there is access to a lower deck of 80m2, making it possible to make an independent apartment. In the basement, there is a garage for two vehicles, a large 35m2 cellar room, boiler room, bathroom, pantry, a built-in sauna and three more rooms, ideal for making another independent apartment, as it has a private entrance from the garden. The main floor of the house was almost completely renovated, the windows are made of solid wood, and the heating is independent with diesel. The garden consists of beautiful trees and vegetation, with a swimming pool and sports court included, with a separate entrance from the side of the plot, since it is an isolated house, on the corner. WHY CHOOSE THIS AREA? The Parque de las Colinas urbanization is located on the road that directly connects Hoyo with the municipality of Torrelodones, so it enjoys excellent communication with both towns. The urbanization has the appropriate infrastructure to satisfy all the needs in terms of public services. Living in a chalet, in the Parque las Colinas urbanization in Hoyo de Manzanares is living in the countryside, but with all the facilities offered by proximity to the capital; At the same time, you have the opportunity for your existence to take place within an architectural heritage, within a natural environment. ARE YOU INTERESTED? At RIVE we have the mission of making the buying and selling of homes quick, simple and secure.We offer instant purchase deals, traditional real estate services, and a wide range of move-in ready apartments for sale and rent.Our team of qualified specialists, backed by artificial intelligence technology, guarantees efficiency and peace of mind in every transaction.If you are interested in seeing it, do not hesitate to contact us, we will be happy to accompany you.",False,{'typology': 'chalet'},good,1031.0,https://www.idealista.com/inmueble/103623984/,https://img3.idealista.com/blur/WEB_LISTING/0/id.pro.es.image.master/59/00/76/1195261381.jpg,Calle Isaac Albéniz,False,-3.9041479,Hoyo de Manzanares,nan,chalet,False,nan
5,Madrid,344.0,True,False,{'title': 'Semi-detached house'},False,5,False,nan,False,28,nan,es,nan,650000.0,102058976,40.6198915,False,"{'hasParkingSpace': True, 'isParkingSpaceIncludedInPrice': True}",sale,nan,"HOGARES GROUP TORRELODONES presents you with this INCREDIBLE OPPORTUNITY, an exclusive semi-detached house for SALE in the beautiful town of Hoyo de Manzanares. With a plot of 409 m² and a construction of 344 m² distributed over 3 levels, this property offers you a LUXURY LIFESTYLE. It has 5 bedrooms and 5 bathrooms, providing ample space for the whole family. Parquet and marble floors add a touch of ELEGANCE AND DISTINCTION to every corner. The property is extremely BRIGHT, thanks to its large windows that allow natural light to enter throughout the day. Enjoy impressive VIEWS of EL PICAZO and MADRID from the comfort of your home. In addition, you can relax and enjoy the outdoors on the large terrace and in the private garden, perfect for moments of tranquility. The large living room and kitchen are ideal spaces to receive family and friends, providing a COZY and WARM ENVIRONMENT to share special moments. In addition, you can take advantage of the amenities of the urbanization, which includes a POOL where you can cool off and enjoy the sunny days. In terms of communication, it has all the nearby services, including: the sports center, a daycare, the school and a secondary education institute, transport network, supermarkets, restaurants or essential shops, as well as the town hall or the center of culture among others. Hoyo de Manzanares is a privileged enclave from an environmental and landscape point of view. This is demonstrated by its incorporation into the Cuenca Alta del Manzanares Regional Park in 1985, its designation by UNESCO on November 9, 1992, as a Biosphere Reserve and its inclusion in the list of Places of Community Interest of the Natura 2000 Network (LIC's). Don't miss this opportunity to acquire a semi-detached house in a PRIVILEGED LOCATION and with all the comforts you deserve. Contact us for more information and to arrange a visit. Come and discover your new home in Hoyo de Manzanares! At HOGARES TORRELODONES we want to make the purchase of your new home easier for you, that is why we offer ""100% FINANCING"". Do not hesitate to CONSULT US WITHOUT COMMITMENT, we will be happy to provide you with all the information you need.",False,"{'typology': 'chalet', 'subTypology': 'semidetachedHouse'}",good,1890.0,https://www.idealista.com/inmueble/102058976/,https://img3.idealista.com/blur/WEB_LISTING/0/id.pro.es.image.master/8b/4f/1b/1142838938.jpg,Hoyo de Manzanares,False,-3.9111736,Hoyo de Manzanares,nan,chalet,False,nan
3,Madrid,240.0,False,False,{'title': 'Terraced house in Calle Villa Bilbao'},False,5,False,nan,False,46,3373-6854,es,nan,414000.0,100415017,40.6215216,False,nan,sale,nan,"Semi-detached house in the mountains of Madrid; prime and private urbanization with mountain views; in Hoyo de Manzanares; perfect condition as a saw house; located 35 km. from Madrid on the A6 highway, very bright and in summer the air flows from one orientation to another extraordinarily; kitchen fully equiped. Natural gas. Private garden. Live in the middle of nature, just a stone's throw from Madrid! You'll love it!",False,"{'typology': 'chalet', 'subTypology': 'terracedHouse'}",good,1725.0,https://www.idealista.com/inmueble/100415017/,https://img3.idealista.com/blur/WEB_LISTING/0/id.pro.es.image.master/91/49/ba/1178216855.jpg,Calle Villa Bilbao,True,-3.9100644,Hoyo de Manzanares,nan,chalet,False,nan
2,Madrid,100.0,False,False,{'title': 'Flat in Urbanización Homan no number'},False,3,False,True,False,56,nan,es,False,295000.0,103610827,40.6209103,True,"{'hasParkingSpace': True, 'isParkingSpaceIncludedInPrice': True}",sale,nan,"REAL ESTATE PROMOTION AND MANAGEMENT HOYO DE MANZANARES sells second floor in an Urbanization in the center of town, completely renovated except for the kitchen in February 2021. Given its special location, it has a lot of light and sunshine throughout the day. The property is distributed in: Distributor hall with a built-in wardrobe that leads: ** On the right hand side to a large living room with fireplace and terrace which is closed facing South. ** to a kitchen with a built-in terrace and a covered clothesline of more than 15 m2 Next 3 bedrooms and two bathrooms. New double glazed windows with mosquito nets, renovated electrical system and bathroom pipes. The house has a non-individualized parking space under the building and a private storage room of 5 m2. Individual gas heating. REAL ESTATE PROMOTION AND MANAGEMENT is a real estate group of personalized services based in the main cities of the country, with two offices open to the public, with more than 20 years of experience and in-depth knowledge of the sector in the most exclusive areas of Madrid, having numerous properties for sale in the central area of Madrid. We have a dynamic team of professionals with higher education: architect and practicing lawyer specialized in real estate registration with experience in personal advice. Our long professional trajectory allows us to offer an excellent management and to find solutions to the needs of each client with the objective of obtaining their satisfaction and confidence. Our work is based on firm pillars, professional treatment, individualized attention to each of the processes and a very specific specialization in each area of action, with an initial individualized development plan for each client. Hoyo de Manzanares is a municipality in the province and Community of Madrid, located to the northwest of said Community, next to the southern slope of the Sierra de Guadarrama. The municipality is crossed by the M-618 highway that connects it with Torrelodones and Colmenar Viejo and a second road that is considered an Avenue even though it leaves the urban area connects it with the La Berzosa Residential City, an urbanization belonging to the municipality and separate of the urban area as well as the Las Colinas Urbanization, located between this municipality and Torrelodones.",False,{'typology': 'flat'},good,2950.0,https://www.idealista.com/inmueble/103610827/,https://img3.idealista.com/blur/WEB_LISTING/0/id.pro.es.image.master/6d/39/55/1194858716.jpg,Urbanización Homan no number,True,-3.9049434,Hoyo de Manzanares,2,flat,False,nan
5,Madrid,464.0,False,False,{'title': 'Detached house in Ardines'},False,6,False,nan,False,29,nan,es,nan,765000.0,103731190,40.6021061,False,"{'hasParkingSpace': True, 'isParkingSpaceIncludedInPrice': True}",sale,"[{'name': 'villaType', 'text': 'Villa'}]","HOGARES TORRELODONES sells THE CHALET OF YOUR DREAMS IN LA BERZOSA, HOYO DE MANZANARES. If you are looking to live in a privileged environment with total privacy and surrounded by nature, this is the perfect place for you! Outstanding features: � Detached villa on a 1765m2 plot. � Large 464m2 home, luminosity in every corner! . � 3 bedrooms with en-suite bathrooms for maximum comfort. �️ A total of 5 bedrooms for the whole family! . � 5 bathrooms, because your comfort is our priority. � Open plan basement, ideal for giving free rein to your imagination. �♂️ Enjoy the private pool on warm summer days. � Garage for 2 cars, there will always be space for everyone. At HOGARES TORRELODONES we want to make the purchase of your new home easier for you, that is why we offer ""100% FINANCING"". Do not hesitate to CONSULT US WITHOUT OBLIGATION, we will be happy to provide you with all the information you need. ☎️ Call for more information and to arrange a visit. Your new home awaits you!",False,"{'typology': 'chalet', 'subTypology': 'independantHouse'}",good,1649.0,https://www.idealista.com/inmueble/103731190/,https://img3.idealista.com/blur/WEB_LISTING/0/id.pro.es.image.master/cf/d3/7d/1198430288.jpg,Ardines,False,-3.9423811,Hoyo de Manzanares,nan,chalet,False,nan
4,Madrid,399.0,False,False,{'title': 'Detached house in Avenida de Madrid'},False,7,False,nan,False,69,nan,es,nan,549000.0,103328316,40.6162329,False,"{'hasParkingSpace': True, 'isParkingSpaceIncludedInPrice': True}",sale,"[{'name': 'villaType', 'text': 'Villa'}]","INVERHOYO CASAS S. L. sells isolated single-family home with pool in Hoyo de Manzanares, less than ten minutes from the town center. The house is distributed over two floors. It has a large garden that surrounds the entire house, as well as a swimming pool on the outside that connects with the interior of the house through a large terrace on several levels. The property has access through the entrance porch to a large hall, which gives access to the main hall of the house and the living-dining room. The interior of the property has a large living-dining room that connects to the terrace; a large independent kitchen and a full bathroom for guests. Through the hallway you access the night area on the main floor; and has the master bedroom with an en-suite bathroom, and three more bedrooms, all of them equipped with built-in wardrobes. For these bedrooms there is another spacious full bathroom with natural ventilation. Both bathrooms have jetted tubs. The property has a large garden with different environments, a garden area up to the porch and terrace at the main entrance, a barbecue area next to the pool, a balcony terrace with views of Madrid and facing south through which you access the living-dining room, wooded and garden area in the back where the clothesline, greenhouse and gas tank are located, accessing the house through a terrace that gives access to the kitchen, finally, in the side area is the well and We have a small area for a garden. The lower floor of the house is distributed in two living rooms, two bedrooms and a bathroom. It also has a garage that can be accessed from inside the house. Inside, the lower floor is connected to the upper floor through stairs that lead to the kitchen. The plot has two accesses from the street, one in the northeast area of the plot that would give access to the main door of the house and another access in the southern area of the plot that would give access to the garage. The house is very well located with respect to the urban area of Hoyo de Manzanares and all the services it offers. It also has a bus stop less than five minutes away. The plot has 1,140 m2. The occupation of the plot is completely filled and there would be a small remainder of buildable area. At the regulatory level, the plot has a dominant residential use but has other compatible uses, which could include healthcare or commercial.",False,"{'typology': 'chalet', 'subTypology': 'independantHouse'}",renew,1376.0,https://www.idealista.com/inmueble/103328316/,https://img3.idealista.com/blur/WEB_LISTING/0/id.pro.es.image.master/87/ab/6f/1185959223.jpg,Avenida de Madrid,False,-3.9053538,Hoyo de Manzanares,nan,chalet,False,nan
5,Madrid,379.0,True,False,{'title': 'Detached house'},False,5,False,nan,False,63,4639,es,nan,825000.0,102084545,40.6098509,False,"{'hasParkingSpace': True, 'isParkingSpaceIncludedInPrice': True}",sale,nan,"Detached Villa for sale in Hoyo De Manzanares, with 4,080 ft², 5 rooms and 5 bathrooms, 2 Parking places and Storage room.",False,"{'typology': 'chalet', 'subTypology': 'independantHouse'}",good,2177.0,https://www.idealista.com/inmueble/102084545/,https://img3.idealista.com/blur/WEB_LISTING/0/id.pro.es.image.master/3d/50/da/1143699916.jpg,Hoyo de Manzanares,False,-3.9388998,Hoyo de Manzanares,nan,chalet,False,nan
2,Madrid,106.0,True,False,{'title': 'Flat in Avenida De La Paloma no number'},True,3,False,True,False,17,nan,es,False,284000.0,97243873,40.6214588,True,"{'hasParkingSpace': True, 'isParkingSpaceIncludedInPrice': True}",sale,nan,"WE ALSO PLAN VISITS ON SUNDAYS AND HOLIDAYS In the Cuenca Alta del Manzanares Regional Park in the historic center we find this bright 106 square meter apartment that is totally exterior and distributed in 3 bedrooms (1 of them en suite), 2 bathrooms, living room with fireplace and kitchen with terrace. Upon entering the living room we find a very large space distributed between the dining area and the living area presided over by an imposing stone fireplace and all wrapped in wonderful natural light thanks to the huge window that also offers us magnificent views. The house is completed by 3 bedrooms (1 of them en suite) with built-in wardrobes, 1 full bathroom with a window and a large kitchen with a terrace. The apartment also has a garage and storage room. The house is in perfect condition with built-in wardrobes in all rooms, PVC windows and double aluminum windows (depending on the room) and natural gas. The apartment is located within one of the most complete and consolidated urbanizations in the town, with a swimming pool, social club, picnic area, basketball court, children's area and well-kept green areas that make this urbanization a perfect place for the enjoyment of the most children and families. At Willhouse we advise you, we put at your disposal our experience, our resources to help you and accompany you in the purchasing process, so that it is simple and safe. We do not charge fees to the buyer and we have Financial Advice.",False,{'typology': 'flat'},good,2679.0,https://www.idealista.com/inmueble/97243873/,https://img3.idealista.com/blur/WEB_LISTING/0/id.pro.es.image.master/0a/5e/db/973399427.jpg,Avenida DE LA PALOMA no number,False,-3.9116819,Hoyo de Manzanares,2,flat,False,nan
4,Madrid,379.0,False,False,{'title': 'Detached house in Av Asturias'},False,5,False,nan,False,38,MG038,es,nan,825000.0,34870138,40.6106179,False,"{'hasParkingSpace': True, 'isParkingSpaceIncludedInPrice': True}",sale,nan,"Detached villa in La Berzosa, Torrelodones-Hoyo de Manzanares, traditional style construction with facades in monolayer cloths and covered in curved tiles. It has an area of 379 m² built, on a plot of 1,050 m². Consolidated garden with automatic irrigation with a large variety of trees, vegetation and grass meadow. Exterior facade in granite masonry with two access doors: pedestrian and vehicles. It consists of 5 bedrooms, 3 of them en suite, 4 bathrooms and 1 toilet. Functional distribution in 2 comfortable plants, plus semi-basement floor. Spacious hall that distributes us to the dining room, guest bedroom suite, courtesy toilet, access to the garage, large kitchen with dining room, pantry, laundry room and iron. From the kitchen there is access to a terrace with summer dining room and the main porch. First floor access by comfortable marble staircase that leads through a large distributor to 2 secondary bedrooms, 1 bathroom, bedroom suite and master bedroom suite with dressing room. All bedrooms with large closets. In basement floor, large warehouse, boiler room and garage for two cars plus ample parking area. Exterior carpentry in aluminum, in white tone, with double glazing. Interior carpentry in white lacquered wood. Marble floors, stoneware and parquet in bedrooms and living room. Smooth paint in all rooms and gas heating. Housing in very good condition and with good qualities. Highlights the brightness and its distribution. Located in a privileged residential area with bus stop near the house, with connection to Torrelodones, Hoyo de Manzanares and Madrid (Moncloa). Next to the Berzoza Social Club with 3 swimming pools, multi-sports courts, tennis and paddle courts. Exit 33 of the A6 (A Coruña).",False,"{'typology': 'chalet', 'subTypology': 'independantHouse'}",good,2177.0,https://www.idealista.com/inmueble/34870138/,https://img3.idealista.com/blur/WEB_LISTING/0/id.pro.es.image.master/23/d1/31/170957773.jpg,Av Asturias,False,-3.9414596,Hoyo de Manzanares,nan,chalet,False,nan
6,Madrid,450.0,False,False,{'title': 'Detached house in Calle del Río Sella'},False,5,False,nan,False,24,nan,es,nan,895000.0,99299558,40.6110624,False,"{'hasParkingSpace': True, 'isParkingSpaceIncludedInPrice': True}",sale,"[{'name': 'villaType', 'text': 'Villa'}]","OIKOS INMOBILIARIA, AGENCY OF TORRELODONES, EXCLUSIVELY SOLD THIS WONDERFUL INDEPENDENT VILLA IN LA BERZOSA, ONE OF THE BEST URBANIZATIONS IN THE AREA, WITH 24-HOUR SECURITY AND A SOCIAL CLUB.CALL 919218558 or 627975882 TO CONTACT US DIRECTLY. It is a modern design house, very bright with large windows in all rooms, 4 bedrooms with spacious fitted wardrobes, 4 full bathrooms, cinema, storage room, garage, 3 terraces, garden and a wonderful pool.The qualities of the house are the best, it has underfloor heating, aerothermal, central vacuum, automatic irrigation and the possibility of expanding many square meters on a lower floor. The house has a large entrance hall that gives access to a large, very bright living-dining room, with high ceilings that gives us a great feeling of spaciousness and is very bright all day, we also have access to a large modern kitchen with design, with lots of light and great space despite having a very large island to be able to live in the kitchen without having to use the dining room, finally on this floor we find a toilet that serves the floor.On this floor we also have a very comfortable garage that allows us to enter the house without having to climb stairs. On the second floor we find the rest area, with 4 very good sized bedrooms, two of them large with a nice shared bathroom, another larger one with an en-suite bathroom and a large terrace, and a very spacious master bedroom with dressing room, en-suite bathroom with shower and bathtub and a small terrace as well.We also have a large living area, with high ceilings and open to the living room below that allows us to have our quiet space on this floor. Finally we have a huge terrace that makes the house perfect, we have a large garden in the same house, an area of rooms that enjoy terraces and to finish a very large terrace where you can enjoy it with family and friends.If there is a future pandemic...the feeling of freedom will not be lacking for the future owner. The house also has a basement that has a storage room, a machine room for the house's facilities, a full bathroom and an incredible very large area on two levels that the owner has as a cinema in the lower area and as a bar. -Disco in the upper area.In addition, this floor has a large room to open, you just have to throw a plasterboard wall, in which the current owner wanted to make a large Turkish bath. The land has 1,168 m2, which gives us a large garden with a beautiful swimming pool around it, a gazebo, a sunbathing area and wide spaces on all sides of the house, both in the pool area and in the the front area of the house or the entrance to the garage where we also have room for more cars apart from the interior garage. The communication of the house is very good since it is located in a wonderful urbanization with a social club and 24-hour security, which consists of a security guard at the sentry box and security cars that continuously circle the urbanization.In the vicinity we have all kinds of services since it is 5 minutes from the center of Torrelodones, in fact it is one of the most popular urbanizations in the area.In terms of transport, there are several bus lines that pass a few meters from the house and it is very close to the A6 to be able to communicate with Madrid center in just 20 minutes. It is a house that is worth visiting, few houses are as well cared for and beautiful as the one we announce today. Consult financing with our financial department without any commitment.",False,"{'typology': 'chalet', 'subTypology': 'independantHouse'}",good,1989.0,https://www.idealista.com/inmueble/99299558/,https://img3.idealista.com/blur/WEB_LISTING/0/id.pro.es.image.master/ed/84/6f/1039725047.jpg,Calle del Río Sella,False,-3.9361373,Hoyo de Manzanares,nan,chalet,False,nan
5,Madrid,400.0,False,False,{'title': 'Detached house in Avenida de Asturias'},False,6,False,nan,False,57,nan,es,nan,1100000.0,103419706,40.6032228,False,"{'hasParkingSpace': True, 'isParkingSpaceIncludedInPrice': True}",sale,"[{'name': 'villaType', 'text': 'Villa'}]","Incredible purchasing opportunity! Located on a 1750m² plot, we present this spectacular property for sale with all the amenities you can imagine. It has an 88 m² swimming pool with a children's area and a relaxing jacuzzi for 5 people. In addition, you can enjoy a newly renovated cement and carpet paddle tennis court to practice your favorite sport. The house also has a large terrace in front of the pool, perfect for enjoying the outdoors, as well as a 25m² gazebo with columns and a large stone table, where you can organize outdoor meetings and events or have drinks because it has up to ice dispenser. The wrought iron chairs give an elegant and sophisticated touch to this space. In addition, you can enjoy delicious roasts and meat or fish thanks to the barbecue and oven made of brick. If you are a nature lover, you will love the small garden with drip installation in production, where you can grow your own vegetables. In addition, you will have a large parking space for 5 vehicles and a wooden shed for tools. Inside the house, you will find 280 m² of main floor, with a very large living room on two levels with fireplace and 3 facades, with a balcony to the terrace and pool. The large modern kitchen with a dining room, plenty of cabinets, refrigerators and a pantry is perfect for food lovers. In addition, you will find 6 bedrooms with dressing rooms, 4 full bathrooms and a guest toilet, as well as an office to work comfortably from home. If that were not enough, the house has an internal staircase that will take you to the 120 m² basement floor, where you will find a billiard room with a large French gift table, wine cellar, gym, warehouse and other spaces that you can use according to your needs. your needs for study or office. Don't miss this unique opportunity to acquire this wonderful property. Contact us right now for more information!",False,"{'typology': 'chalet', 'subTypology': 'independantHouse'}",good,2750.0,https://www.idealista.com/inmueble/103419706/,https://img3.idealista.com/blur/WEB_LISTING/0/id.pro.es.image.master/84/d8/90/1189739149.jpg,Avenida de Asturias,False,-3.9402804,Hoyo de Manzanares,nan,chalet,False,nan
