bathrooms,province,size,hasPlan,topNewDevelopment,suggestedTexts,hasVideo,rooms,has360,exterior,hasStaging,numPhotos,externalReference,country,hasLift,price,propertyCode,latitude,showAddress,parkingSpace,operation,labels,description,newDevelopment,detailedType,status,priceByArea,url,thumbnail,address,has3DTour,longitude,municipality,floor,propertyType,topPlus,highlight
3,Madrid,293.0,True,False,{'title': 'Detached house in Joaquin Turina no number'},True,5,False,nan,False,83,nan,es,nan,625000.0,101980315,40.60526,True,"{'hasParkingSpace': True, 'isParkingSpaceIncludedInPrice': True}",sale,"[{'name': 'villaType', 'text': 'Villa'}]","PROMOCIÓN Y GESTIÓN INMOBILIARIA HOYO DE MANZANARES sells, without charging fees to the buyer, an ISOLATED SINGLE-FAMILY HOUSE, built on a 1,006-square-meter plot, flat and consolidated with trees, in the Parque de las Colinas urbanization, 2.5 km from the urban center of Hoyo de Manzanares, bordering a green area. Nearby is the Cuenca Alta del Manzanares Regional Park. South orientation. This unique independent villa with excellent views of the mountains and Madrid, of 293 m2 built, consists of two floors distributed in five bedrooms and three full bathrooms as well as a garage floor for two motor vehicles and a storage room and an attic. Street level floor: Garage, multifunctional room, kitchen, toilet and storage room where there is a new diesel tank. Main floor: hall through which there is access to a toilet, kitchen that communicates with the living room and this in turn with a porch that overlooks the garden and pool area. The living-dining room has a fireplace that heats the main floor and attic. The house has a lot of light First floor: master bedroom with fitted wardrobes en suite with bathroom and terrace with views of the mountains and Madrid. Another room that could be used for a dressing room and another double room with fitted wardrobes and bathroom. Ground Floor or Attic: Spacious room with incredible views and where the heat from the fireplace arrives. Another room with a porthole window and a small dressing room. And, pool tiled around it given the large space of the plot facing South. Hoyo de Manzanares is a municipality in the province and Community of Madrid, located northwest of said Community, next to the southern slope of the Sierra de Guadarrama. It has a stable population of 8,032 inhabitants, a figure that increases in summer due to the influx of families with second homes in this town, although this trend is decreasing as many families settle permanently. The municipality is located within the Cuenca Alta del Manzanares Regional Park, which, with an extension of 52,796 hectares, was created by the Community of Madrid in 1985. In addition, this space has been a Biosphere Reserve since February 15, 1993, and is classified as a Site of Community Importance in compliance with the Habitats Directive. The municipality is crossed by the M-618 road that connects it with Torrelodones and Colmenar Viejo and a second road that is considered an Avenue.",False,"{'typology': 'chalet', 'subTypology': 'independantHouse'}",renew,2133.0,https://www.idealista.com/inmueble/101980315/,https://img3.idealista.com/blur/WEB_LISTING/0/id.pro.es.image.master/6f/bc/11/1141494710.jpg,JOAQUIN TURINA no number,True,-3.9006673,Hoyo de Manzanares,nan,chalet,False,nan
2,Madrid,102.0,True,False,{'title': 'Flat in urbanización La Orotava no number'},True,3,False,True,False,46,nan,es,False,269000.0,95000465,40.6206617,True,"{'hasParkingSpace': True, 'isParkingSpaceIncludedInPrice': True}",sale,nan,"PROMOTION AND REAL ESTATE MANAGEMENT OF HOYO DE MANZANARES sells a very bright SECOND floor in La Orotava Urbanization, with a large, unassigned garage space, under the same building and a storage room of approximately 3 m2 on the ground floor. The apartment is distributed in: Very spacious 23 m2 living room with fireplace, kitchen, three bedrooms and two bathrooms. The main room has an en-suite bathroom. The urbanization has common areas, a social club with a restaurant, swimming pools, a playground, two tennis courts, a sports court and a pergola for the enjoyment of residents. The apartment is very close to the center of town and has a 611 bus stop at the entrance of the urbanization that connects Hoyo de Manzanares with Madrid.",False,{'typology': 'flat'},good,2637.0,https://www.idealista.com/inmueble/95000465/,https://img3.idealista.com/blur/WEB_LISTING/0/id.pro.es.image.master/ab/b6/01/1135689821.jpg,urbanización La Orotava no number,True,-3.9154735,Hoyo de Manzanares,2,flat,False,nan
2,Madrid,139.0,True,False,{'title': 'Duplex in Calle Eras'},False,3,False,True,False,24,nan,es,False,269000.0,103370216,40.6260073,False,nan,sale,nan,"HOGARES TORRELODONES SELLS: MAGNIFICENT APARTMENT IN HOYO DE MANZANARES! It is a gem that combines comfort, style and an unbeatable location, an opportunity that you will not want to miss. This property is perfect for those looking for a combined cozy and modern space. Distributed: Main floor: Spacious and bright living room, separate kitchen and a TOILET. Upper floor: Three large bedrooms, a bathroom (with the possibility of doing it en suite), built-in wardrobes and a full bathroom. Completely renovated and ready to move in Located close to all services, you will have quick access to shops, restaurants and other amenities such as bus stops, shops, schools, etc. Centrally located, this apartment is perfect for those looking for a safe investment. Don't miss this opportunity to live in a beautiful apartment in Hoyo de Manzanares! At HOGARES TORRELODONES we want to make the purchase of your new home easier for you, that is why we offer ""100% FINANCING"". Do not hesitate to CONSULT US WITHOUT OBLIGATION, we will be happy to provide you with all the information you need.",False,"{'typology': 'flat', 'subTypology': 'duplex'}",good,1935.0,https://www.idealista.com/inmueble/103370216/,https://img3.idealista.com/blur/WEB_LISTING/0/id.pro.es.image.master/0e/42/bd/1187469096.jpg,Calle Eras,False,-3.908052,Hoyo de Manzanares,1,duplex,False,nan
5,Madrid,400.0,False,False,{'title': 'House'},False,6,False,nan,False,50,XAL_635,es,nan,1000000.0,103799598,40.6216104,False,"{'hasParkingSpace': True, 'isParkingSpaceIncludedInPrice': True}",sale,nan,"Allegro Inmobiliaria is pleased to offer you this WONDERFUL INDEPENDENT VILLA for Sale in La Berzosa that stands on practically ONE FLOOR, which provides GREAT COMFORT and FLUIDITY in its habitability. Its 1,700m2 PLOT has fantastic spaces to enjoy SPORTS and LEISURE in a relaxing environment surrounded by NATURE. Its spectacular POOL with a PERGOLA fully equipped with a WOOD OVEN where you can prepare roasts or delicious artisanal pizzas; classic BBQ, as well as a barbecue designed to prepare espetos and savor them on its beautiful granite table custom-made by local stonemasons. PADEL court, JACUZZI and GARDEN. Without forgetting its very large COVERED PARKING area. This home also stands out for its BRIGHTNESS and very PLEASANT SPACES. We enter the house through the hall from which we access its beautiful living room and dining room that are joined by a warm wood-burning fireplace open to both rooms. These rooms are surrounded by large windows (this space has 3 solar orientations due to its great luminosity). ) that give direct access to a beautiful and large outdoor porch. From the hall we also go to an office and a complete and modern equipped kitchen with an office area, laundry room and service area with bedroom and bathroom. Mention that access to the kitchen is also directly from the parking area for greater convenience. Next is the guest toilet and a first bedroom suite with its bathroom. At this time a pleasant living room gives way to the master bedroom, also en-suite with its bathroom and 4 other bedrooms and 2 bathrooms. In total there are 6 bedrooms (3 en suite) and 4 bathrooms plus 1 toilet. From this living room there is access to a 130m2 ground floor where we find another game room equipped with a French pool table, an open space, a workshop area and storage spaces. This house can be easily adapted to people with reduced mobility with gentle ramps that would give direct access to the main areas of the house. Other data of interest: <.",False,{'typology': 'chalet'},good,2500.0,https://www.idealista.com/inmueble/103799598/,https://img3.idealista.com/blur/WEB_LISTING/0/id.pro.es.image.master/f4/e8/41/1200490784.jpg,Hoyo de Manzanares,False,-3.9085408,Hoyo de Manzanares,nan,chalet,False,nan
4,Madrid,350.0,True,False,{'title': 'Detached house'},False,6,False,nan,False,37,nan,es,nan,800000.0,102825928,40.6278302,False,"{'hasParkingSpace': True, 'isParkingSpaceIncludedInPrice': True}",sale,nan,"350m² villa built on a 1045m² plot with spectacular views of Mount Picazo and Tortoise, next to the Manzanares Basin Regional Park, with the mountains of Toledo and Madrid on the horizon. Built in a cul-de-sac, surrounded by other buildings and at the same time independent. It is part of a group of homes called the Vindel neighborhood. The house has 3 floors. On the main floor there is an entrance hall that leads to a 30m² living-dining room with a fireplace, forming an L with access to the garden and direct access to a 12m² furnished kitchen-dining room, and there is also a guest toilet. On the first floor, there are three bedrooms with built-in wardrobes, one suite with a bathroom: hydromassage, jacuzzi and two sinks and a dressing room, and also a full bathroom in the hall, with a bathtub. On the first mezzanine there is another bedroom with a built-in wardrobe. In the low mansard roof there is a 40m² multipurpose space with skylight. On the semi-basement floor there is the 40m² garage, with automated doors both inside and outside, as well as a 20m² storage room. The heating is by diesel, with radiators in all rooms, the floors are stoneware and the walls are painted in white, the exterior carpentry is simple aluminum and the interior is made of pine/walnut wood. We highlight the beautiful views from any point of the house. Its location is privileged, with easy access to public transportation, green areas and trails for outdoor activities, just 8-10 minutes from the town center. The proximity to a shopping center, medical center, school, institute, supermarkets and restaurants guarantees a comfortable and practical life for its residents.",False,"{'typology': 'chalet', 'subTypology': 'independantHouse'}",renew,2286.0,https://www.idealista.com/inmueble/102825928/,https://img3.idealista.com/blur/WEB_LISTING/0/id.pro.es.image.master/9c/c9/bc/1192188726.jpg,Hoyo de Manzanares,False,-3.9047803,Hoyo de Manzanares,nan,chalet,False,nan
4,Madrid,436.0,True,False,{'title': 'Detached house in Calle Ardines'},False,5,True,nan,False,51,218467,es,nan,1285000.0,103519084,40.6008845,False,"{'hasParkingSpace': True, 'isParkingSpaceIncludedInPrice': True}",sale,"[{'name': 'villaType', 'text': 'Villa'}]","This quiet and well-kept villa is special. It has south orientation and 436 m² built in three heights intelligently distributed based on half floors, which facilitates accessibility to the rooms by having fewer stairs and provides plenty of light to all rooms. First floor:  Spacious living dining room with a nice porch, access to the garden and views to the pool and bbk.  Kitchen equipped with all appliances and pantry.   1 comfortable bedroom with bathroom en suite.  1 guest toilet. Middle floor:  Comfortable and spacious independent reading room with fireplace, susceptible to be transformed into a cozy bedroom. Top floor destined to rest area:  Three spacious bedrooms, one with en suite bathroom, dressing room.  Quiet attic living room with the possibility of being a bedroom incorporating en suite bathroom.  1 large bathroom with shower. Basement floor:  Spacious living room wine cellar where you can enjoy family or friends.  1 spacious and bright room.  Large room for laundry area.  Two pantries, susceptible to make a bathroom if desired. This part of the house could be considered as an independent apartment with all the services and great luminosity. Plot / Garden: The house has a renovated plot already updated to facilitate maintenance and reduce related costs, on a plot of 1,025 m2. - Saline water pool with solar shower, 32 m2, easily monitored from the house. - Barbecue area with stove and gazebo. - Separate area for reading/relax. - Area for play/sports area for children. - Space reserved for vegetable garden with tool shed. - It has a well, with the possibility of installing geothermal energy. - Closed garage for 2 cars. Outdoor space for 3/4 vehicles. And many other features that give the house a great value, here are some: - Domotics for electric windows and garage. - Air conditioning, low consumption as the overall thermal sensation in hot weather is very pleasant. - Heating of individual consumption, propane gas network of the urbanization. - Built-in closets, lacquered doors. - Wooden or tiled floors depending on the rooms. - Double glazed windows. - Armored access door to the house. Nestled in a protected mountain area, La Berzosa has private security 24 hrs and is located near the town of Torrelodones. It has a primary care medical center, and is located 10' from HM Torrelodones Hospital. Social Club and Civic Center with restaurant, sports facilities including swimming pool. Close to CC Espacio Torrelodones (fashion stores and Alcampo supermarket. At the educational level, the Los Tajetes nursery school, the Virgen de la Encina public school, and the Antonio de Nebrija University. At 29 km from Madrid, it is located at exit 33 of the A-6 (La Coruña highway). Connected by the 611 intercity bus line of Madrid, with stops distributed throughout the urbanization, head in the center of Hoyo de Manzanares and Madrid-Moncloa. By car, less than 5 minutes from the Renfe stations of Torrelodones and La Navata. Do not miss this opportunity! Live peacefully enjoying with your family in the middle of nature. Call us and we will arrange a visit to your future home, you will not regret it.",False,"{'typology': 'chalet', 'subTypology': 'independantHouse'}",good,2947.0,https://www.idealista.com/inmueble/103519084/,https://img3.idealista.com/blur/WEB_LISTING/0/id.pro.es.image.master/0d/9d/1d/1192054778.jpg,Calle Ardines,False,-3.9416568,Hoyo de Manzanares,nan,chalet,False,nan
3,Madrid,372.0,True,False,{'title': 'Detached house in Camino De Villaba'},True,5,False,nan,False,73,nan,es,nan,650000.0,100989587,40.6232925,False,"{'hasParkingSpace': True, 'isParkingSpaceIncludedInPrice': True}",sale,"[{'name': 'stoneHouseType', 'text': 'Stone house'}]","PROMOCIÓN Y GESTIÓN INMOBILIARIA DE HOYO DE MANZANARES sells, without charging fees to the buyer, a wonderful detached stone house with 238,33m² built, plus 2 auxiliary buildings of 54,76m² and 78,57m², on a plot of 1.347, 88m² in beautiful surroundings, with absolutely exceptional location being very close to the town center in the middle of nature and with excellent views. The entrance to this magnificent manor house is very wide being the stone road. It is accessed by wide stone stairs leading to a magnificent porch glazed on one side, and overlooking the plot and the natural environment.  The house is distributed in two comfortable floors. On the main floor there is a spacious living room with fireplace, 2 bedrooms and a bathroom. following there is access to two other very cozy and bright rooms as they are glazed, these spacious rooms on the first floor have many possibilities for redistribution. Through a wide and comfortable staircase leads to the second floor, where you will find the master bedroom suite with dressing room and bathroom, and three other spacious and bright rooms, one of them fully glazed with stunning mountain views and a bathroom that serves them. Annexed to the house at the rear are two auxiliary buildings, one of them equipped with a full kitchen. Hoyo de Manzanares is a municipality in the province and Community of Madrid, located in the northwest of the Community, next to the southern slope of the Sierra de Guadarrama. It has a stable population of 8,032 inhabitants, a figure that increases in summer due to the influx of families with second homes in this town, although this trend is decreasing as many families settle permanently. The municipality is located within the Cuenca Alta del Manzanares Regional Park, which, with an area of 52,796 hectares, was created by the Community of Madrid in 1985. In addition, this area has been a Biosphere Reserve since February 15, 1993, and is catalogued as a Site of Community Importance in compliance with the Habitats Directive. The municipality is crossed by the M-618 road that connects it with Torrelodones and Colmenar Viejo and a second road that is considered an avenue, although it leaves the urban area, connects it with the Ciudad Residencial La Berzosa, a housing development belonging to the municipality and separated from the urban area, as well as the Urbanización Las Colinas, located between this municipality and Torrelodones.",False,"{'typology': 'chalet', 'subTypology': 'independantHouse'}",good,1747.0,https://www.idealista.com/inmueble/100989587/,https://img3.idealista.com/blur/WEB_LISTING/0/id.pro.es.image.master/22/06/3a/1106255022.jpg,Camino DE VILLABA,True,-3.9189255,Hoyo de Manzanares,nan,chalet,False,nan
2,Madrid,126.0,True,False,{'title': 'Flat in fresnos'},True,3,False,True,False,28,nan,es,True,329000.0,103364064,40.6199819,False,"{'hasParkingSpace': True, 'isParkingSpaceIncludedInPrice': True}",sale,nan,"DELANAORIVERA Incredible purchasing opportunity! A spacious and bright apartment for sale in Hoyo de Manzanares, with impressive views of the Picazo. This property is located in an urbanization that has a swimming pool, tennis court and gardens, perfect for enjoying moments of relaxation and fun outdoors. With an area of 126m², this apartment has been completely renovated and has all the comforts you need. Its spacious living room opens to a glazed terrace, ideal for enjoying the views at any time of the year. The kitchen is fully furnished and equipped, in addition to having a practical clothesline. This apartment has three bedrooms, all of them with built-in wardrobes, and two full bathrooms, one with a shower and the other with a bathtub. In addition, it has natural gas central heating and aluminum exterior carpentry, which guarantees excellent thermal and acoustic insulation. The location of this property is unbeatable, since it is close to schools, supermarkets, library, social center and restaurants. In addition, our real estate agency offers additional services such as renovations, mortgages, alarms and moving. We also offer the possibility of 100% financing and we have a manufacturing service for modular houses and studios on available plots. Don't miss this unique opportunity to acquire an apartment in an excellent location, with all the comforts and services you need. Contact us now for more information and request a no-obligation quote! You can also find more similar properties on our website and social networks (Instagram, TikTok).",False,{'typology': 'flat'},good,2611.0,https://www.idealista.com/inmueble/103364064/,https://img3.idealista.com/blur/WEB_LISTING/0/id.pro.es.image.master/50/28/2b/1187163660.jpg,fresnos,False,-3.9097961,Hoyo de Manzanares,2,flat,False,nan
5,Madrid,470.0,True,False,{'title': 'Detached house in ernesto lecuona'},True,7,False,nan,False,32,3452-01231,es,nan,795000.0,103138734,40.6054837,False,"{'hasParkingSpace': True, 'isParkingSpaceIncludedInPrice': True}",sale,nan,"INDEPENDENT SINGLE-FAMILY HOUSE for sale between Torrelodones and Hoyo de Manzanares. Housing in an environment of NATURE, with SPACIOUS and BRIGHT rooms and spectacular views. This Detached house has 470m2 built, on a 574m2 plot and borders the NATURAL PLACE of the UPPER MANZANARES BASIN.The house is in perfect condition and is ready to move into. It is distributed over 3 floors: It has two living rooms (the main one on the ground floor and another in the attic), a fully equipped kitchen with an office area, seven bedrooms (two of them en suite and two with independent outdoor terraces).Five bathrooms.Pelet FIREPLACES in the main living room and on the second floor (bedrooms). AIR CONDITIONING and hot/cold PUMP, Daikin brand in living room and attic. Parking for two cars.Canadian wooden floors, high quality enclosures with automatic blinds throughout the house. From the living room and kitchen there are several porches from where you can enjoy the spectacular views. It has a well-cared for and consolidated garden with different varieties of trees and plants.with automatic irrigation. SOLAR PANELS have recently been installed, the boiler is diesel. It has no Community expenses and the annual IBI is €1,400 With a reduction of almost 70% due to the installation of solar panels and the aid offered by the Hoyo de Manzanares City Council In the Parque las Colinas urbanization in Hoyo de Manzanares you have the possibility of living comfortably in a home with all the comforts that the house itself offers you.This urbanization is located on the road that directly connects Hoyo with the municipality of Torrelodones, so it has excellent communication with easy access from the A6 and close to Torrelodones and the urban area of Hoyo de Manzanares.It has several direct bus stops to Madrid and Torrelodones and has the Nebrija University. The Parque las Colinas urbanization in Hoyo de Manzanares has the appropriate infrastructure to satisfy all your needs in terms of public services: Buses: intercity bus line 610 connects the Parque las Colinas urbanization in Hoyo de Manzanares with nearby communities such as Colmenar Viejo and Torrelodones.The 611A communicates with Madrid directly and quickly, stopping at the train station near Las Matas.This bus line also passes through Torrelodones, and is active from Monday to Friday.For the night service, it is given only on weekends, and all services end in the Las Colinas de Hoyo de Manzanares urbanization. Trains: about 10 kilometers away is the Torrelodones station and 12 km away is the Las Matas station, with which you can communicate with Hoyo de Manzanares using bus lines 611A and 611. Taxis: the Las Colinas urbanization provides 4 taxis that serve the community of inhabitants. Education: There are 2 daycare centers to care for your children (one public and one private), a public school for primary and early childhood education and one for secondary education.A private University for higher education and Educational Environmental Center. It has the Tourist Information Center, as it is located within the Biosphere Reserve.And all basic infrastructure services. This is a unique opportunity to acquire the home of your dreams.Don't hesitate to contact us for more information and to schedule a visit.This announcement is not binding and may contain errors.It is shown for informational purposes and is not contractual. Mortgage appraisal management.",False,"{'typology': 'chalet', 'subTypology': 'independantHouse'}",good,1691.0,https://www.idealista.com/inmueble/103138734/,https://img3.idealista.com/blur/WEB_LISTING/0/id.pro.es.image.master/2e/77/d0/1179536346.jpg,ernesto lecuona,False,-3.8974838,Hoyo de Manzanares,nan,chalet,False,nan
