bathrooms,province,size,hasPlan,topNewDevelopment,suggestedTexts,hasVideo,rooms,has360,exterior,hasStaging,numPhotos,externalReference,country,hasLift,price,propertyCode,latitude,showAddress,parkingSpace,operation,labels,description,newDevelopment,detailedType,status,priceByArea,url,thumbnail,address,has3DTour,longitude,district,municipality,floor,propertyType,neighborhood,topPlus,highlight
8,Madrid,1026.0,True,False,"{'subtitle': 'Zona Pueblo, Pozuelo de Alarcón', 'title': 'Detached house'}",True,7,False,nan,False,77,PV8404I,es,nan,2790000.0,103620803,40.4443341,False,"{'hasParkingSpace': True, 'isParkingSpaceIncludedInPrice': True}",sale,"[{'name': 'luxuryType', 'text': 'Luxury'}]","A wonderful villa with a sober and elegant design and a rustic flavour in the most exclusive residential complex in Pozuelo. Layout: MAIN FLOOR: - A fantastic entrance hall with a large hall wardrobe that leads to the living rooms and divides the day area from the night area. •Day area: - The main living room connects to all the social rooms in the house. Lofty ceilings, wooden finishes with beautiful beams, and the huge fireplace provide an elegant rustic flavour to the property. Direct access to the main terrace that affords excellent views of the garden.  - A lounge with a fireplace and charming views next to the main living room. - The dining room connects to a fabulous porch with views of the pool and also connects with the main living room and the kitchen. - The huge kitchen with a central island, pantry and utility area provides access to a second porch with views of the garden. - A guest WC. - A large separate laundry room that connects to the kitchen. •Night area: - Three spacious double bedrooms with en-suite bathrooms and large wardrobes. FIRST FLOOR: - It is divided into two wings. The largest private part is dedicated to the master bedroom with a terrace, a large walk-in closet, a stunning en-suite bathroom, and an office or private lounge. - Another two large bedrooms share a reception area and a large bathroom and can be found in the other wing of this floor. LOWER FLOOR: - A large lounge with natural light and a fireplace. - Wine cellar. - A WC. - A large bedroom with an en-suite bathroom for the staff. - Three storerooms. Outward facing: - A fantastic, cobbled area and extensive landscaped areas, a separate garage, and a roofed porch for bicycles. - The main garden provides views of Madrid. Its main feature is a beautiful pool with a charming porch and barbecue area. A well-groomed piece of land with vegetation. An excellent and elegant villa with a sober and timeless design in the most exclusive residential complex in Pozuelo, Los Álamos de Bularas. The sophisticated and elegant style based on a combination of finishes and materials, beautiful natural stone and solid wood, provide this villa, located in one of the most exclusive residential complexes in Pozuelo, with a certain feeling of a property that, without leaving Madrid, transports us to natural areas that one would not expect to find in a large city. The house stands out for its ample and generous rooms, with lofty ceilings and large windows that connect all the rooms with the well-tended garden, without sacrificing the comfort provided by the materials used, especially the use of wood and the presence of fireplaces that add a welcoming touch to all the rooms. Located in the exclusive Los Álamos de Bularas residential complex, a gated estate with 24-hour security, the villa stands on a plot measuring more than 3,200 m2. The plot is located on a corner with a slight slope, which means you can enjoy excellent views from the property and absolute privacy without renouncing the security of a gated estate. An exceptional location just 12 minutes from Madrid, with easy access to the A6 and M40. It is just minutes from the best international schools, hospitals, leisure facilities, and shops, such as the Corte Inglés department store in Pozuelo. CONTACT US TO SHOW YOU HOUSES THAT WE ARE NOT PUBLISHING This important municipality of Madrid occupies an area of 42 km2 and has a population of approximately 84,000. It is 11 kilometres from the centre of the capital and borders with Aravaca. In addition to several bus and tram lines, there are two suburban stations: one in Pozuelo and another in El Barrial, next to the El Corte Ingles department store. In addition it is connected via the A-6, M-500 and M-40. Among the many residential estates that exist here, we can highlight La Finca, Somosaguas and Álamos de Bularas. From a town development point of view, in some cases flats have been built near shopping areas while in others, semi-detached.",False,"{'typology': 'chalet', 'subTypology': 'independantHouse'}",good,2719.0,https://www.idealista.com/inmueble/103620803/,https://img3.idealista.com/blur/WEB_LISTING/0/id.pro.es.image.master/0d/87/0e/1202369316.jpg,subdistrict Zona Pueblo,True,-3.8164952,Zona Pueblo,Pozuelo de Alarcón,nan,chalet,Zona Pueblo,False,nan
3,Madrid,162.0,True,False,"{'subtitle': 'Somosaguas, Pozuelo de Alarcón', 'title': 'Flat'}",True,3,False,True,False,61,PV8645I,es,False,1190000.0,103671261,40.4158643,False,"{'hasParkingSpace': True, 'isParkingSpaceIncludedInPrice': True}",sale,nan,"CONTACT US TO SHOW YOU HOUSES THAT WE ARE NOT PUBLISHING Somosaguas is a luxury residential estate that is only 10 kilometres from Madrid. It features excellent security measures, as all the inhabitants consider peace and privacy key requirements. In fact, public personalities from the world of culture, politics and music live here. Belonging to Pozuelo de Alarcon, Somosaguas is well connected by bus and tram. Above all, it is surrounded by the Casa de Campo, the city's great green lung. There are excellent schools, shopping centres and the Complutense University Campus. The Carretera de Castilla (Castile Road) will enable you to reach the city centre in 5 minutes.",False,{'typology': 'flat'},good,7346.0,https://www.idealista.com/inmueble/103671261/,https://img3.idealista.com/blur/WEB_LISTING/0/id.pro.es.image.master/11/a2/6d/1196662287.jpg,subdistrict Somosaguas,True,-3.7870474,Somosaguas,Pozuelo de Alarcón,bj,flat,Somosaguas,False,nan
3,Madrid,285.0,True,False,"{'subtitle': 'Zona Pueblo, Pozuelo de Alarcón', 'title': 'Terraced house in Calle Javier Fernández Golfín'}",True,4,False,nan,True,57,VMO2310011,es,nan,799000.0,103031550,40.43234,False,"{'hasParkingSpace': True, 'isParkingSpaceIncludedInPrice': True}",sale,nan,"SEMI-DETACHED HOUSE WITH PORCH AND TWO LIVING ROOMS, IN URBANIZATION WITH COMMON AREAS AND SWIMMING POOL IN POZUELO DE ALARCON Apropreties presents this magnificent townhouse of 285 m2 with two living rooms and 4 bedrooms. When accessing the house we do it through a porch, where you can have an outdoor sofa area, once crossed the threshold of the door we enter a spacious hall, from there you enter the kitchen with office area, it has windows on both sides allowing excellent ventilation and makes it very bright, also has a clothesline area. From the hall there is access to a large living room that has a terrace, through it and down a small flight of stairs leads to the outside porch. The covered garage where you can comfortably fit a car is on this floor and has a door that communicates with the entrance hall, thus accessing directly to the house. On the second floor up the stairs we find the master bedroom with en suite bathroom and large fitted closets. There are also on this floor 3 more large bedrooms with fitted closets that share a bathroom. In the basement, we have a closet under stairs, a toilet, although its size can be converted into a bathroom with shower, a large cellar for storage and a large bright living room of about 40 m2, which also has direct access to the outside porch via stairs up. The covered porch is therefore linked to the two living rooms. From it there is access to the communal garden of the urbanization and the swimming pool. The urbanization has a lush garden, children's play area and swimming pool, Can you imagine living here?",False,"{'typology': 'chalet', 'subTypology': 'terracedHouse'}",good,2804.0,https://www.idealista.com/inmueble/103031550/,https://img3.idealista.com/blur/WEB_LISTING/0/id.pro.es.image.master/58/0f/51/1175726489.jpg,Calle Javier Fernández Golfín,True,-3.817839,Zona Pueblo,Pozuelo de Alarcón,nan,chalet,Zona Pueblo,False,nan
2,Madrid,159.0,True,False,"{'subtitle': 'Zona Avenida Europa, Pozuelo de Alarcón', 'title': 'Duplex in Avenida De Europa'}",True,3,False,True,False,46,FR190774,es,True,1100000.0,102885281,40.4403444,False,"{'hasParkingSpace': True, 'isParkingSpaceIncludedInPrice': True}",sale,nan,"With impressive views of the Madrid skyline, Gilmar presents an exclusive penthouse in the best urbanization on Avenida de Europa in Pozuelo. A home built in 2013 with well-combined top quality materials, a careful design and in perfect condition. The 159m2 house has three bedrooms and two bathrooms plus 15m2 of terrace on the ground floor and 72m2 of terrace on the roof. East orientation, storage room, and two parking spaces included in the price A luxury home in the northwest area of Madrid that you cannot miss if you can afford it and are thinking of moving house. CHARACTERISTICS: 3 rooms; 2 bathrooms; 87m2 of Terraces Heating: Underfloor heating Air conditioner Elevator Community garden Pool Paddle Court Alarm Clothes line 24 hour security doorman Condition: very good 2 Garage Spaces Storage room.",False,"{'typology': 'flat', 'subTypology': 'duplex'}",good,6918.0,https://www.idealista.com/inmueble/102885281/,https://img3.idealista.com/blur/WEB_LISTING/0/id.pro.es.image.master/4a/ec/58/1170790591.jpg,Avenida DE EUROPA,True,-3.7870379,Zona Avenida Europa,Pozuelo de Alarcón,3,duplex,Zona Avenida Europa,False,nan
5,Madrid,394.0,True,False,"{'subtitle': 'Zona Pueblo, Pozuelo de Alarcón', 'title': 'Detached house'}",True,7,False,nan,True,45,PL191186,es,nan,1200000.0,103336388,40.438715,False,"{'hasParkingSpace': True, 'isParkingSpaceIncludedInPrice': True}",sale,"[{'name': 'villaType', 'text': 'Villa'}]","Detached Villa in Pozuelo de Alarcón! This 394 m2 property is located on a 758 m2 plot facing West, which guarantees excellent natural lighting. Furthermore, this great property could be expanded. The house has 3 floors, 7 bedrooms, 5 bathrooms, 1 living room and a wide variety of amenities. On the ground floor, we find a large hall, a living room with fireplace, a kitchen with access to the garden, an en-suite room and a single room. There is also a cleaning room, a toilet and an ironing area. On the first floor, we find the master bedroom suite with dressing room and terrace, two double bedrooms, a single bedroom and a bathroom. The basement has a bedroom, a bathroom with a shower, a garage with capacity for two cars, a pantry, a storage room and a small room. The interior carpentry is made of painted wood and the exterior carpentry is aluminum. The heating is individual natural gas and it also has air conditioning. In addition, the property has a swimming pool to enjoy the summer with the family. Don't miss the opportunity to acquire this magnificent property in one of the most exclusive areas of Madrid! Contact us for more information.",False,"{'typology': 'chalet', 'subTypology': 'independantHouse'}",good,3046.0,https://www.idealista.com/inmueble/103336388/,https://img3.idealista.com/blur/WEB_LISTING/0/id.pro.es.image.master/ee/59/f1/1188108396.jpg,subdistrict Zona Pueblo,True,-3.8235886,Zona Pueblo,Pozuelo de Alarcón,nan,chalet,Zona Pueblo,False,nan
9,Madrid,1077.0,True,False,"{'subtitle': 'Somosaguas, Pozuelo de Alarcón', 'title': 'Detached house'}",True,9,False,nan,True,37,PL61064,es,nan,6000000.0,101340225,40.4268234,False,"{'hasParkingSpace': True, 'isParkingSpaceIncludedInPrice': True}",sale,"[{'name': 'luxuryType', 'text': 'Luxury'}, {'name': 'villaType', 'text': 'Villa'}]","Discover the elegance and comfort of living in this independent villa located on a spectacular 3000 square meter plot. This impressive property offers a construction of 1077 square meters, distributed over three comfortable floors. The master bedroom has its own bathroom and dressing room. In addition, there are six other bedrooms with their respective en-suite bathrooms, offering a unique and exclusive accommodation experience. This home also has two service bedrooms, a service bathroom and a guest toilet, which provide comfort and privacy to its inhabitants. The main living room, divided into three rooms, offers a feeling of spaciousness and light, while the cinema room provides additional space to enjoy moments of leisure and fun. The garden is simply spectacular, with a swimming pool and a large consolidated green area and a wide variety of plants and flowers, which makes it a perfect place to relax outdoors. Its garage with capacity for six cars is a detail that cannot be missing in a property of this magnitude.",False,"{'typology': 'chalet', 'subTypology': 'independantHouse'}",good,5571.0,https://www.idealista.com/inmueble/101340225/,https://img3.idealista.com/blur/WEB_LISTING/0/id.pro.es.image.master/9e/27/83/1139860552.jpg,subdistrict Somosaguas,True,-3.8034842,Somosaguas,Pozuelo de Alarcón,nan,chalet,Somosaguas,False,nan
4,Madrid,238.0,True,False,"{'subtitle': 'Zona Estación, Pozuelo de Alarcón', 'title': 'Terraced house'}",True,4,False,nan,True,64,FR185444,es,nan,885000.0,101399733,40.4555131,False,"{'hasParkingSpace': True, 'isParkingSpaceIncludedInPrice': True}",sale,nan,"Corner semi-detached house for sale in a privileged, quiet area surrounded by green areas. This home has a private garden and a pool shared with 4 neighbors. Occupying a 238 m2 plot and having 296 m2 built on 4 floors, this house offers ample space to enjoy with the family. On the ground floor, we find a porch, a hall, a kitchen with an office, a large living-dining room with a fireplace and a guest toilet. Upstairs, there are 2 bedrooms that share a full bathroom and a master suite. The attic has another suite and a large terrace. On the semi-basement floor, there is a multipurpose room, a storage room and a pantry. In addition, this house has a closed garage space on the street level with independent access. Regarding its location, it is close to supermarkets, bars, sports, cultural, educational and commercial centers. This home is in good condition and has 4 bedrooms and 4 bathrooms. It is south facing, with wooden interior carpentry and aluminum exterior carpentry. It has individual natural gas heating, pre-installation of air conditioning, alarm, swimming pool, barbecue and garage. Don't miss the opportunity to acquire this house in a quiet and well-connected area. Contact us for more information!",False,"{'typology': 'chalet', 'subTypology': 'terracedHouse'}",renew,3718.0,https://www.idealista.com/inmueble/101399733/,https://img3.idealista.com/blur/WEB_LISTING/0/id.pro.es.image.master/ed/8d/1a/1124613443.jpg,subdistrict Zona Estación,True,-3.7990138,Zona Estación,Pozuelo de Alarcón,nan,chalet,Zona Estación,False,nan
7,Madrid,703.0,True,False,"{'subtitle': 'Montealina, Pozuelo de Alarcón', 'title': 'Detached house'}",True,5,False,nan,True,42,FR165695,es,nan,1900000.0,95539683,40.4372997,False,"{'hasParkingSpace': True, 'isParkingSpaceIncludedInPrice': True}",sale,"[{'name': 'villaType', 'text': 'Villa'}]","Gilmar offers one of the outstanding properties of the Monte Alina urbanization for sale. It is a last phase Levitt model MGRANADA chalet, with spectacular views and maximum privacy from its neighbors. This house has been expanded and improved, it offers more than 700m2 built in good condition. On a plot of 1,440, it enjoys a garden with a swimming pool and consolidated landscaping, which is undoubtedly a differential factor with respect to other homes in the urbanization, it will be a very outstanding aspect for its future owner. Within the urbanization it is located in a very quiet cul-de-sac. Monte Alina is one of the reference urbanizations in the Northwest area of Madrid, with a single entrance-exit it allows it to offer a high degree of security to its neighbors with very reasonable expenses, it has consolidated trees in common areas and avenues, tracks community tennis and paddle courts, playgrounds and above all the direct access of the owners to Monte de Boadilla. The area has a very complete range of services, clinics and hospitals (Quirón University Hospital, Madrid-Montepríncipe, Puerta de Hierro, etc. ), schools and universities, shopping, sports and leisure centres, etc. , as well as a complete transport network. public, Metro-Light, buses and suburban RENFE. A property that you cannot miss if you are looking for a home in the Northwest area of Madrid. DISTRIBUTION: BASEMENT: Garage for 5 cars, facilities room, cellar, living room, storage room, laundry room and iron, toilet, GROUND FLOOR: Front porch, distributor, lounge, living room, dining room, living room, kitchen with office and pantry, distributor, service room, service bathroom, garden room, rear porch. FIRST FLOOR: room with en-suite bathroom, room-shared bathroom, bedroom, master suite with bathroom and dressing room, family room, various rooms. CHARACTERISTICS: Interior carpentry: wood Exterior carpentry: wood Heating: hot air Air conditioner Alarm Swimming pool Tennis-Paddle.",False,"{'typology': 'chalet', 'subTypology': 'independantHouse'}",good,2703.0,https://www.idealista.com/inmueble/95539683/,https://img3.idealista.com/blur/WEB_LISTING/0/id.pro.es.image.master/54/c0/5c/962435169.jpg,subdistrict Montealina,True,-3.8534852,Urbanizaciones,Pozuelo de Alarcón,nan,chalet,Montealina,False,nan
6,Madrid,571.0,True,False,"{'subtitle': 'La Cabaña, Pozuelo de Alarcón', 'title': 'Detached house'}",True,7,False,nan,True,36,FR187388,es,nan,1050000.0,101848958,40.4160098,False,"{'hasParkingSpace': True, 'isParkingSpaceIncludedInPrice': True}",sale,"[{'name': 'villaType', 'text': 'Villa'}]","Gilmar presents an exclusive Detached Villa in the La Cabaña urbanization. With 571 m2 built on a 755 m2 plot, this spacious home is distributed over 4 floors and enjoys a beautiful plot with a consolidated garden with a pool, privacy and unobstructed views. The ground floor has a hall, living-dining room, living room/office, kitchen with office, guest toilet and a large porch. The bedroom floor has a master suite with bathroom and terrace, suite 2, room 3, room 4 and shared full bathroom. The attic floor has another bedroom 5 with a terrace, room 6, a bathroom with a shower and a large open-plan living room with a terrace. In the basement we find a living room with a roof style, bathroom, laundry room, pantry, utility room and garage. La Cabaña is a very well located urbanization and the development of the ARPO plan will increase the range of services and the frequency of transport in the coming years. In its surroundings it has sports clubs, shopping, cultural, sports and leisure centers, and a wide range of public and private medical centers. Everything a family may need in their daily lives and just a few minutes from the capital. A home in good condition and with spaces to delight a large family that cannot be missed before deciding to purchase in the northwest area of Madrid. DISTRIBUTION: BASEMENT: Garage, Andalusian room, laundry room, pantry, bedroom, bathroom GROUND FLOOR: Hall, living-dining room, guest toilet, kitchen with office, living room, porch FIRST FLOOR: Hall, master suite with bathroom and terrace, suite with bathroom, bedroom, bedroom with terrace, full bathroom. ATTIC: Hall, open room with terrace, bedroom, bedroom with terrace and full bathroom. CHARACTERISTICS: Interior carpentry: wood Exterior carpentry: Climalit glass Heating: individual natural gas Air conditioning (ground and upper floor) Alarm Pool.",False,"{'typology': 'chalet', 'subTypology': 'independantHouse'}",good,1839.0,https://www.idealista.com/inmueble/101848958/,https://img3.idealista.com/blur/WEB_LISTING/0/id.pro.es.image.master/76/6b/79/1140632053.jpg,subdistrict La Cabaña,True,-3.8311697,Urbanizaciones,Pozuelo de Alarcón,nan,chalet,La Cabaña,False,nan
3,Madrid,162.0,True,False,"{'subtitle': 'Zona norte, Pozuelo de Alarcón', 'title': 'Flat'}",True,3,False,True,True,28,NY191516,es,True,650000.0,103113162,40.4596518,False,"{'hasParkingSpace': True, 'isParkingSpaceIncludedInPrice': True}",sale,nan,"CHANCE! Bright renovated home, facing SOUTHEAST. It includes a large garage space and a large storage room of 16m2. It is located in a private urbanization with security, swimming pool, paddle tennis, green areas and gym. Its extraordinary luminosity stands out, the result of windows considerably larger than most properties. In the living room, two large wall-to-wall windows offer unparalleled lighting, making the most of sun exposure. The house is distributed in the following rooms: Separate living room - dining room, facing the urbanization. Enjoy very pleasant views. The kitchen has been recently renovated to a high-end design, including Miele appliances and high-quality furniture. In addition, it has a practical clothesline and a bar area for eating. The 18m2 master suite has multiple large-capacity built-in wardrobes and a large full bathroom. It has two additional double bedrooms, both equipped with built-in wardrobes. The house has two independent full bathrooms, one of them is currently used as a guest toilet but is easily reconvertible to its original state (adding a total of 3 full bathrooms). The northern area of Pozuelo is characterized by being a quiet area, located in an environment surrounded by parks and nature. Furthermore, it is in continuous revaluation as new businesses and services have been established in the area. Very close to the Corte Inglés. All kinds of services within a 5-minute walk: Mercadona, BM supermarket, gas station, pharmacies, restaurants, gyms, paddle tennis club and veterinarian. Excellent road communication with the center of Madrid. Quick access to the M-40 and A6. Various nearby public transportation options (bus and train).",False,{'typology': 'flat'},good,4012.0,https://www.idealista.com/inmueble/103113162/,https://img3.idealista.com/blur/WEB_LISTING/0/id.pro.es.image.master/27/af/05/1179319365.jpg,subdistrict Zona norte,True,-3.8007674,Zona norte,Pozuelo de Alarcón,2,flat,Zona norte,False,nan
9,Madrid,1170.0,True,False,"{'subtitle': 'Somosaguas, Pozuelo de Alarcón', 'title': 'Detached house'}",True,8,False,nan,False,43,PV8585I,es,nan,3900000.0,102582888,40.4209573,False,"{'hasParkingSpace': True, 'isParkingSpaceIncludedInPrice': True}",sale,"[{'name': 'luxuryType', 'text': 'Luxury'}, {'name': 'villaType', 'text': 'Villa'}]","A large 1,170 m² house under renovation on an excellent plot close to the main entrance checkpoint to the residential complex. It is close to shopping and leisure facilities. Easy access to public transport and the main roads. The Somosaguas A residential complex is known for its natural surroundings and 24-hour security.  The property consists of two buildings, one of which can become two dwellings or a dwelling and another professional activity. It has 8 bedrooms/rooms, all with en-suite bathrooms.  It also features several lounges and staff quarters. There are 8 sheltered parking spaces. CONTACT US TO SHOW YOU HOUSES THAT WE ARE NOT PUBLISHING Somosaguas is a luxury residential estate that is only 10 kilometres from Madrid. It features excellent security measures, as all the inhabitants consider peace and privacy key requirements. In fact, public personalities from the world of culture, politics and music live here. Belonging to Pozuelo de Alarcon, Somosaguas is well connected by bus and tram. Above all, it is surrounded by the Casa de Campo, the city's great green lung. There are excellent schools, shopping centres and the Complutense University Campus. The Carretera de Castilla (Castile Road) will enable you to reach the city centre in 5 minutes.",False,"{'typology': 'chalet', 'subTypology': 'independantHouse'}",good,3333.0,https://www.idealista.com/inmueble/102582888/,https://img3.idealista.com/blur/WEB_LISTING/0/id.pro.es.image.master/7a/e0/5c/1200353144.jpg,subdistrict Somosaguas,True,-3.7867451,Somosaguas,Pozuelo de Alarcón,nan,chalet,Somosaguas,False,nan
