bathrooms,province,size,hasPlan,topNewDevelopment,suggestedTexts,hasVideo,rooms,has360,exterior,hasStaging,numPhotos,externalReference,country,hasLift,price,propertyCode,latitude,showAddress,parkingSpace,operation,labels,description,newDevelopment,detailedType,status,priceByArea,url,newDevelopmentFinished,thumbnail,address,has3DTour,longitude,district,municipality,floor,propertyType,topPlus,highlight
9,Madrid,815.0,True,False,"{'subtitle': 'Castillo - Campodón, Villaviciosa de Odón', 'title': 'Detached house'}",True,7,True,nan,False,104,VMO2303004,es,nan,1195000.0,100826177,40.3604102,False,"{'hasParkingSpace': True, 'isParkingSpaceIncludedInPrice': True}",sale,"[{'name': 'villaType', 'text': 'Villa'}]","VERY BRIGHT HOUSE WITH GARDEN AND POOL IN VILLAVICIOSA DE ODÓN. In this property of 815 m² and 1.804 m² plot, according to the land registry, each space has been conveniently designed for comfort and functionality. The square floor plan with wide central staircase and high ceilings provides this house with fluidity, harmony and luminosity. It is a house designed for the family, with large and cozy common areas and spacious independent bedrooms; all of them with large windows, fitted closets and generous en suite bathrooms, something very unusual. It has underfloor heating and air conditioning in all rooms. The distribution of spaces is presented on 4 floors: Ground floor: Elegant hall, living room with fireplace, kitchen with island, pantry and laundry room. The kitchen and dining room are connected by a distributor that also leads to the terrace and a guest bathroom with shower. This floor includes an office and a bedroom with bathroom en suite. Second floor: The sleeping area is distributed around the staircase and has five bedrooms; four of them en suite, a bedroom fitted out as a living room and a separate bathroom. The master bedroom also has a large dressing room and a luxurious marble bathroom. Attic: It is a diaphanous space of 66 m² with multiple possibilities, which enjoys excellent luminosity and ventilation thanks to its eight ceiling windows. Basement: We find on this floor a living room of 76 m², with fireplace and pre-installation for a bar if desired. A storage room of 15 m², a cellar, a bedroom, two bathrooms, a boiler room and a garage of 95 m² with 5 parking spaces. Outside, it offers beautiful views of its landscaped garden and pool from the charming back porch. The garden also has a built-in barbecue. The whole house is surrounded by a careful selection of trees, fruit trees and aromatic and ornamental plants such as roses, jasmine and pomegranate trees. This construction of 2001 has excellent qualities and noble materials. Its state of conservation is impeccable, ideal to move in. Located in the quiet urbanization of Campodon, Villaviciosa de Odon, the house is just minutes from the city center and renowned private schools such as Euro Colegio Casvi or Villa Alkor. Well connected with public transport, bus lines 510 and 518 and quick access to the roads M506, M50. Can you imagine living here?",False,"{'typology': 'chalet', 'subTypology': 'independantHouse'}",good,1466.0,https://www.idealista.com/inmueble/100826177/,nan,https://img3.idealista.com/blur/WEB_LISTING/0/id.pro.es.image.master/61/d1/ca/1124880215.jpg,Castillo - Campodón,False,-3.8778412,Castillo - Campodón,Villaviciosa de Odón,nan,chalet,False,nan
8,Madrid,1250.0,True,False,"{'subtitle': 'Castillo - Campodón, Villaviciosa de Odón', 'title': 'Detached house in Calle asturias, 21'}",True,9,True,nan,True,80,nan,es,nan,1195000.0,101491782,40.357399,True,"{'hasParkingSpace': True, 'isParkingSpaceIncludedInPrice': True}",sale,"[{'name': 'villaType', 'text': 'Villa'}]","S15 Real Estate sells EXCLUSIVELY, WITHOUT COMMISSIONS FOR THE BUYER, this splendid land, with two properties, in the Campondón Urbanization, Villaviciosa de Odón., Unique plot in the area of Los Castillos, Campodón - Villaviciosa de Odón due to the total m2 available and its location, a great opportunity for Investors. Properties built on a wonderful 4000m2 plot, it has two independent chalets, swimming pool, tennis court, a fantastic barbecue, heavily wooded garden area, and perfectly consolidated.The plot can be segregated into two independent plots of 2000 m2 each. The price for the total of the two plots/two properties is €1,900,000 If you are only interested in the main house, which has a total of 1,173m2 built, its price €1,200,000, The other house, with a total of 150 m2 built, its price €700,000 The main house has three floors, with the following distribution, Basement floor we find a large hall from which we access on one side a fantastic living room with a wine cellar, a game area with a pool table, a toilet and a bedroom with a seating area and bathroom.On the other hand, two bedrooms with bathroom and finally a large garage with a storage area. Main floor has a covered terrace with a perimeter arch.We enter the house finding an elegant hall with a wardrobe and a glass door that gives access to a large living room, arranged on two levels, on one side, a dining area and on the other, a living area with a fireplace. We continue and access the kitchen, completely renovated, which has an office area, living room, with a pantry room, washing and ironing area.In this area, next to the ironing room, we find a service bedroom with a bathroom. We return to the living-dining room where we find on the right an independent area, with two bedrooms, two bathrooms, a small kitchen and a beautiful living room with a fireplace that can be accessed, independently, from the main entrance. We go up to the first floor, distributor and sleeping area.Master bedroom with full bathroom en suite, dressing room and terrace.Two other bedrooms, a full bathroom, terrace and dressing area. The construction has a continuous trench foundation, solid brick walls and a laminated steel structure, made of reinforced ceramic, covered with curved tiles. Last renovation carried out in 2011. The second house, 150 m2, completely renovated, has two floors. It is a property with a lot of light, thanks to the large windows that surround the main floor. The main floor, is the upper floor of the house, has a fully glazed living room with a fireplace.Bathroom with shower, kitchen and room that is currently an office. On the lower floor, which gives access to the garden and tennis court, we find a laundry area, a bedroom, and the master bedroom with a large en-suite bathroom. The entire house has security windows, with electric blinds.Independent air conditioning on both floors.Adjustable lights throughout the house. In the outdoor area we find a beautiful garden with a swimming pool in perfect condition, a barbecue area with stone tables in the garden area.Tennis court. Large semi-covered garage for about 8 cars, with automatic access door. This is a property with many possibilities, with a fantastic location in the luxurious urbanization of Campodón, Villaviciosa de Odón.Just 15 minutes from the center of Madrid, this urbanization has all the main services at hand, supermarkets, health centers, public and private hospitals, schools, universities, restaurants, shopping centers, pharmacies, health centers and sports centers.",False,"{'typology': 'chalet', 'subTypology': 'independantHouse'}",good,956.0,https://www.idealista.com/inmueble/101491782/,nan,https://img3.idealista.com/blur/WEB_LISTING/0/id.pro.es.image.master/39/80/db/1189096879.jpg,"Calle asturias, 21",False,-3.8754036,Castillo - Campodón,Villaviciosa de Odón,nan,chalet,False,nan
3,Madrid,324.0,True,False,"{'subtitle': 'El Bosque, Villaviciosa de Odón', 'title': 'Semi-detached house in Urbanización Monte de la Villa no number'}",True,4,False,nan,False,29,Chalet 05,es,nan,620000.0,103648517,40.3708952,True,"{'hasParkingSpace': True, 'isParkingSpaceIncludedInPrice': True}",sale,nan,"Monte de la Villa Class is the new residential proposal of the Asentis group in the municipality of Villaviciosa de Odón. 48 chalets, designed by and for you. Designed with precision and dedication to meet and meet the needs of the whole family. Located in one of the central plots of the Monte de la Villa sector, Asentis offers you a wide range of types of 4 and 5 bedroom chalets, configured in two heights so that space is the protagonist of your new home. To complete this experience in which space is the true articulator of each home. All the villas in the promotion have large private outdoor areas with surfaces ranging from 166 m2 to 284 m2, in which you can enjoy without risks and with family and friends. Quality and precision in each finish, where the latest advances in clean energy provide maximum climate comfort through a radiant and refreshing floor system, and where energy efficiency and the minimization of the carbon footprint have inspired all construction solutions. Let yourself be surprised by the common areas designed in every detail so that both adults and children can enjoy multiple activities in a safe space. Swimming pool, paddle tennis, gym, table tennis and a putting green where you can practice your short game, complete our wide range of common spaces. Your new house is waiting for you in the best development of Villaviciosa de Odón, come and discover it.",True,"{'typology': 'chalet', 'subTypology': 'semidetachedHouse'}",newdevelopment,1914.0,https://www.idealista.com/obra-nueva/103648517/,False,https://img3.idealista.com/blur/WEB_LISTING/0/id.pro.es.image.master/8d/73/e5/1084448701.jpg,Urbanización Monte de la Villa no number,False,-3.9321782,El Bosque,Villaviciosa de Odón,nan,chalet,False,nan
3,Madrid,194.0,True,False,"{'subtitle': 'El Bosque, Villaviciosa de Odón', 'title': 'Semi-detached house in Urb. Monte de la Villa, 1'}",True,4,False,nan,False,14,MVL Chalet 17,es,nan,650000.0,102748526,40.37136,True,"{'hasParkingSpace': True, 'isParkingSpaceIncludedInPrice': True}",sale,nan,"Monte la Villa 64 is the new Avantespacia project to the west of the Community of Madrid, in the Monte la Villa sector, in Villaviciosa de Odón, a short distance from the Financial City of Santander and the City of Image. A modern private urbanization of 64 semi-detached houses with 4 bedrooms and an office, perfectly integrated into one of the most outstanding natural environments in the North of Madrid, bordering the El Bosque Urbanization, one of the richest and most diverse natural enclaves in the province. An exclusive residential complex that prioritizes quality of life and that has a control booth and great benefits: swimming pools, paddle tennis court, multipurpose court, gym, green areas and playground. And it offers the possibility of personalizing your home; Consult our Personalization Service. More information in our Avantespacia Commercial Office located in VillaCenter Av. of the Prince of Asturias, 129. Local B-20.",True,"{'typology': 'chalet', 'subTypology': 'semidetachedHouse'}",newdevelopment,3351.0,https://www.idealista.com/obra-nueva/102748526/,False,https://img3.idealista.com/blur/WEB_LISTING/0/id.pro.es.image.master/ea/99/00/1160886802.jpg,"Urb. Monte de la Villa, 1",False,-3.92847,El Bosque,Villaviciosa de Odón,nan,chalet,False,nan
3,Madrid,194.0,True,False,"{'subtitle': 'El Bosque, Villaviciosa de Odón', 'title': 'Semi-detached house in Urb. Monte de la Villa, 1'}",True,4,False,nan,False,14,MVL Chalet 5,es,nan,665000.0,101390955,40.37136,True,"{'hasParkingSpace': True, 'isParkingSpaceIncludedInPrice': True}",sale,nan,"Monte la Villa 64 is the new Avantespacia project to the west of the Community of Madrid, specifically in the Monte la Villa sector, in Villaviciosa de Odón, a short distance from the Financial City of Santander and the Image City. A modern private urbanization of 64 semi-detached single-family homes with 4 bedrooms and an office, perfectly integrated into one of the most outstanding natural environments in the North of Madrid, bordering the El Bosque Urbanization, one of the richest and most diverse natural enclaves in the province. An exclusive residential complex that prioritizes quality of life and that has a control booth and great benefits: swimming pools, paddle tennis court, multipurpose court, gym, green areas and playground. Monte la Villa 64 is a clear invitation to invest in comfort and well-being in a privileged location that perfectly combines nature, tranquility and services, just a step away from Madrid. Non-contractual indicative image.",True,"{'typology': 'chalet', 'subTypology': 'semidetachedHouse'}",newdevelopment,3428.0,https://www.idealista.com/obra-nueva/101390955/,False,https://img3.idealista.com/blur/WEB_LISTING/0/id.pro.es.image.master/5c/a4/6f/1160894632.jpg,"Urb. Monte de la Villa, 1",False,-3.92847,El Bosque,Villaviciosa de Odón,nan,chalet,False,nan
3,Madrid,194.0,True,False,"{'subtitle': 'El Bosque, Villaviciosa de Odón', 'title': 'Semi-detached house in Urb. Monte de la Villa, 1'}",True,4,False,nan,False,14,MVL Chalet 56,es,nan,675000.0,101390924,40.37136,True,"{'hasParkingSpace': True, 'isParkingSpaceIncludedInPrice': True}",sale,nan,"Monte la Villa 64 is the new Avantespacia project to the west of the Community of Madrid, specifically in the Monte la Villa sector, in Villaviciosa de Odón, a short distance from the Financial City of Santander and the City of Image. A modern private urbanization of 64 semi-detached single-family homes with 4 bedrooms and an office, perfectly integrated into one of the most outstanding natural environments in the North of Madrid, bordering the El Bosque Urbanization, one of the richest and most diverse natural enclaves in the province. An exclusive residential complex that prioritizes quality of life and that has a control booth and great benefits: swimming pools, paddle tennis court, multipurpose court, gym, green areas and playground. Monte la Villa 64 is a clear invitation to invest in comfort and well-being in a privileged location that perfectly combines nature, tranquility and services, just a step away from Madrid. Non-contractual indicative image.",True,"{'typology': 'chalet', 'subTypology': 'semidetachedHouse'}",newdevelopment,3479.0,https://www.idealista.com/obra-nueva/101390924/,False,https://img3.idealista.com/blur/WEB_LISTING/0/id.pro.es.image.master/3d/9f/8a/1160886492.jpg,"Urb. Monte de la Villa, 1",False,-3.92847,El Bosque,Villaviciosa de Odón,nan,chalet,False,nan
3,Madrid,211.0,True,False,"{'subtitle': 'El Bosque, Villaviciosa de Odón', 'title': 'Semi-detached house in Calle Manzana 18 Plan parcial El Monte de la Villa , 18'}",True,4,False,nan,False,35,A,es,nan,684950.0,96696501,40.3660589,True,"{'hasParkingSpace': True, 'isParkingSpaceIncludedInPrice': True}",sale,nan,"We present ""Residencial El Lago de Las Hadas"", a spectacular urbanization made up of 32 semi-detached houses with an avant-garde and elegant design, where we highlight the volumetry and design of the facades that make this residential shine with its own light, and with about 3.000m of community area made up of wide walks and recreation areas, green areas, a water raft and a spectacular community pool with artificial grass, and of course with a children's pool with the little ones in the house in mind. The residential is made up of 8 semi-detached corner houses with a total plot of 351m and almost 200m of free land, and 24 semi-detached houses with a total plot of 299m and about 150m of free land.The 32 houses are equal in meters and distribution, having 211m built on 2 floors. On the ground floor we find 3 parking spaces on the surface, which we access through an automatic sliding door.Once inside the house, we access through a spacious 7-meter hall that gives access to the 16m kitchen that has been designed in a semi-open concept, to a hall with a built-in wardrobe and access to the bathroom with a shower tray. shower and window, and a comfortable office of almost 11 meters that also has a built-in wardrobe, so it can perfectly be considered as a room if necessary.The dining room of almost 40 meters is characterized by the spaciousness and luminosity conferred by the 3 large windows that give access to the porches and garden that it has. On the first floor we find 3 large bedrooms.The main room is 16m2, plus the large dressing area and the en-suite bathroom with a window and a shower tray.It also gives access to a wonderful terrace of almost 11m that is oriented to the interior of the plot, and therefore has pleasant views of the common area of the residential.The secondary rooms are 12m and 13m, one of them having access to a private terrace.In the same way, there is the secondary bathroom, which in this case comes standard with a bathtub, and you can opt for a shower tray free of charge if you prefer.The third terrace of almost 11 meters has access from the hall, and in this case it would be oriented towards the front facade of the house.As a differentiating element, and always thinking of the practicality and comfort of the buyers, we find a laundry room in which to locate the washer and dryer on the floor of the rooms. The houses have the highest qualities designed for comfort and energy performance.The facades combine large-format prefabricated exposed concrete in white and gray, with wood-effect details, making it a visually warm home.The interior carpentry will be lacquered in white with ceramic floors imitating wood, and with windows with thermal bridge break, being tilt-and-turn and sliding.We also have an extensive list of customization options to suit each of the buyers. Find out without obligation, don't hesitate and come to see this innovative project that will undoubtedly become the house of your dreams!",True,"{'typology': 'chalet', 'subTypology': 'semidetachedHouse'}",newdevelopment,3246.0,https://www.idealista.com/obra-nueva/96696501/,False,https://img3.idealista.com/blur/WEB_LISTING/0/id.pro.es.image.master/9f/52/0f/953947888.jpg,"Calle Manzana 18 Plan parcial El Monte de la Villa , 18",False,-3.9444121,El Bosque,Villaviciosa de Odón,nan,chalet,False,nan
3,Madrid,194.0,True,False,"{'subtitle': 'El Bosque, Villaviciosa de Odón', 'title': 'Semi-detached house in Urb. Monte de la Villa, 1'}",True,4,False,nan,False,14,MVL Chalet 22,es,nan,655000.0,102745760,40.37136,True,"{'hasParkingSpace': True, 'isParkingSpaceIncludedInPrice': True}",sale,nan,"Monte la Villa 64 is the new Avantespacia project to the west of the Community of Madrid, specifically in the Monte la Villa sector, in Villaviciosa de Odón, a short distance from the Financial City of Santander and the Image City. A modern private urbanization of 64 semi-detached single-family homes with 4 bedrooms and an office, perfectly integrated into one of the most outstanding natural environments in the North of Madrid, bordering the El Bosque Urbanization, one of the richest and most diverse natural enclaves in the province. An exclusive residential complex that prioritizes quality of life and that has a control booth and great benefits: swimming pools, paddle tennis court, multipurpose court, gym, green areas and playground. Monte la Villa 64 is a clear invitation to invest in comfort and well-being in a privileged location that perfectly combines nature, tranquility and services, just a step away from Madrid. Non-contractual indicative image.",True,"{'typology': 'chalet', 'subTypology': 'semidetachedHouse'}",newdevelopment,3376.0,https://www.idealista.com/obra-nueva/102745760/,False,https://img3.idealista.com/blur/WEB_LISTING/0/id.pro.es.image.master/5c/a4/6f/1160894632.jpg,"Urb. Monte de la Villa, 1",False,-3.92847,El Bosque,Villaviciosa de Odón,nan,chalet,False,nan
3,Madrid,361.0,True,False,"{'subtitle': 'El Bosque, Villaviciosa de Odón', 'title': 'Semi-detached house in Urbanización Monte de la Villa no number'}",True,5,False,nan,False,29,Chalet 23,es,nan,645000.0,102753041,40.3708952,True,"{'hasParkingSpace': True, 'isParkingSpaceIncludedInPrice': True}",sale,nan,"Monte de la Villa Class is the new residential proposal of the Asentis group in the municipality of Villaviciosa de Odón. 48 chalets, designed by and for you. Designed with precision and dedication to meet and meet the needs of the whole family. Located in one of the central plots of the Monte de la Villa sector, Asentis offers you a wide range of types of 4 and 5 bedroom chalets, configured in two heights so that space is the protagonist of your new home. To complete this experience in which space is the true articulator of each home. All the villas in the promotion have large private outdoor areas with surfaces ranging from 166 m2 to 284 m2, in which you can enjoy without risks and with family and friends. Quality and precision in each finish, where the latest advances in clean energy provide maximum climate comfort through a radiant and refreshing floor system, and where energy efficiency and the minimization of the carbon footprint have inspired all construction solutions. Let yourself be surprised by the common areas designed in every detail so that both adults and children can enjoy multiple activities in a safe space. Swimming pool, paddle tennis, gym, table tennis and a putting green where you can practice your short game, complete our wide range of common spaces. Your new house is waiting for you in the best development of Villaviciosa de Odón, come and discover it.",True,"{'typology': 'chalet', 'subTypology': 'semidetachedHouse'}",newdevelopment,1787.0,https://www.idealista.com/obra-nueva/102753041/,False,https://img3.idealista.com/blur/WEB_LISTING/0/id.pro.es.image.master/8d/73/e5/1084448701.jpg,Urbanización Monte de la Villa no number,False,-3.9321782,El Bosque,Villaviciosa de Odón,nan,chalet,False,nan
